duolingo,my only complaints are i think the hearts should be unlimited.,1
duolingo,i like learning spanish and i can't do that if it's limiting me on how many mistakes i'm allowed to make.,1
duolingo,and when i do the speaking test i'm positive i'm saying it right and it doesn't process right sometimes and i loose a heart.,1
duolingo,"but what i don't like is that i have to wait like 5 hours for 1 heart, so you can't really make mistakes when that's part of learning a new language.",1
duolingo,i think we should get more hearts like 5 hearts in an hour.,1
duolingo,only lost a star as i think it would be helpful to have a section on phrases you will need on travelling to italy earlier on which i personally would have found reassuring.,1
duolingo,"good with basis, but you would have thought the as pay for the lessons, bit you have to get these heart things which discourages you from learning.",1
duolingo,i wish they had something that explains the tense of words it really would be helpful.,1
duolingo,"i also hate that when your out of hearts you have to wait a certain amount of time before you can play again, unless you accumulate them through practice runs.",1
duolingo,they are only features on the computer version.,1
duolingo,it's a great pp but sometimes the hints don't exactly help you with questions.,1
duolingo,plus some languages don't have the tips section.,1
duolingo,i'm learning russian and there is no tips page so i have to assume what the ending of the noun is.,1
duolingo,there's also not much content regarding what you can spend your lights on.,1
duolingo,"would love a range of outfits to motivate me to earn more lights, or a house!",1
duolingo,would also love that to be available.,1
duolingo,unfortunately doesn work well put of good wife bones - clashes and fails to work on g,1
duolingo,sadly enough you can't start at a higher level,1
duolingo,"however, for learning arabic, i would tread with caution, as the lessons have a bad habit of mixing modern standard arabic with dialect arabic, which should never be done.",1
duolingo,looks great but it didn't have that.,1
duolingo,"it frequently freeze, and random doesn't record my progress.",1
duolingo,there also seems to be issues singing between the webster and the pp.,1
duolingo,"i would like to see the stories on the pp, not just the site.",1
duolingo,and it would be nice to be able to collapse the lessons once you pass a checkpoint.,1
duolingo,all that strolling is tedious.,1
duolingo,:) and a vocal review.,1
duolingo,"the only downside is that it does not explain rules or basis, so the approach is really intuition (a guessing game sometimes, and left to your interpretation of the rules as you go along in learning translations).",1
duolingo,would be good if they had a reference portion if you want to understand grammar rules.,1
duolingo,"the only reason it is not 5 stars is one of the voices has too thick an accent to hear properly, and it is only on guess work that i get the words and phrases correct when her voice is used.",1
duolingo,"being dutch, it is interesting to use this pp but often very frustration, particularly with computer voices that race through a sentence with the consequence of misunderstanding the words.",1
duolingo,"the translations into english are often strange to my ears, obviously 'dictionary translations' and not in english vernacular, having unusual placement of nous and verbs.",1
duolingo,"the dutch is often extra long minded, not simple to translate, even for me.",1
duolingo,"that's a pity, because many times the first word is an article and identifying the gender is a challenging part in some languages.",1
duolingo,"i have a couple of suggestions: 1) the sentences are never too complicated and they rarely used vocabulary from previously completed lessons; 2) in the word selection pool most of the time the first word has a capital letter, which makes it too easy to identify.",1
duolingo,"for new languages however, i'd like for there to be writing included.",1
duolingo,"i can type in the spanish, but for the organ and japanese there isn't even tracing.",1
duolingo,"i had to log back in, but at least it was better than waiting a week for a response from their team (that never happened).",1
duolingo,"the only thing keeping me from giving it five stars is the speaking portions; i'm taking organ, so i don't know if the other languages are like this, but the lady talks way too fast.",1
duolingo,"there's no option for her to speak more slowly, or to say the sentence in parts.",1
duolingo,it'd be helpful if you could practice the sentence in parts more slowly before trying to repeat the whole thing.,1
duolingo,with japanese i went to another pp that moves through the lessons more slowly but gives me a more solid rounding in things i really need to know better.,1
duolingo,will you be adding barque to the list at some time?,1
duolingo,"4 stars only because i would like to see a feature whereby it listens to my pronunciation, which roseola stone does have.",1
duolingo,"for example, in a ""match the pairs"" part of the italian portion, it asks to match the english words with their italian translation.",1
duolingo,"very good, only want to communicate casually, annoying to be punished for minor spelling mistakes but otherwise can't complain at all.",1
duolingo,"i love this pp, it should start full conversations though.",1
duolingo,"( completing the circles, etc) but it's too pick about minor spelling errors.",1
duolingo,you have to keep tying a whole long complicated sentence over and over because of one or two small errors.,1
duolingo,the more complicated grammar is equally frustration.,1
duolingo,the more different grammar needs to start with simple tasks rather than whole sentence translations.,1
duolingo,some of the achievements are begged.,1
duolingo,"however i've already completed the league, and did not get the achievement.",1
duolingo,"great pp, but please fix your achievements.",1
duolingo,"the way domingo reaches is great; however, the pp is increasingly adding paywalls and is taking most user interactivity away.",1
duolingo,"clubs, which were a good way for users to learn from each other if kept active, were discontinued, and leaderboards replaced them.",1
duolingo,"leaderboards make people more competitive, but there's no way to root for each other or learn about others so that they are more than just numbers...",1
duolingo,"root voices for spoken french, japanese, and german makes it difficult to know if pronunciation accurate but is a relatively ok stand-in for humans speaking.",1
duolingo,grammar lessons would be a very welcome addition.,1
duolingo,"however, there are some minor changes i would like to see: 1. please make it harder to pass the test (i have never failed once) 2. please add drawing characters in different languages (not just choosing) otherwise, it's a wonderful free application with only a 2-second ad at the end of each lesson.",1
duolingo,sometimes the sound files are broken and also if the english translation isn't exactly as the have it the answer will be marked wrong.,1
duolingo,the german language pp is more complete than the japanese pp.,1
duolingo,"however, the as are very annoying and you only get so many chances to get the answers right or you have to wait until the next day.",1
duolingo,"i find that there is no explanation of words before hand, you're left to figure it out on your own.",1
duolingo,you also have to spell correctly to complete challenges.,1
duolingo,its more of a bunch of quires than a relaxed learning experience.,1
duolingo,"i rate this four stars instead of five because although it's very helpful, most of the sentences they teach you, you wouldn't need to know or they are things that you wouldn't normally say.",1
duolingo,"i think they should teach you basic sentences that you would use everyday rather than something like ""lots of young men live in america"" or something similar to that.",1
duolingo,"besides my journey, there is one thing bother me and it is the hearts.",1
duolingo,it would be a lot more fun if i didn't have to wait four hours for at least one heart.,1
duolingo,"you need to do lots of practices, and spend more than 5-10 minutes a day or you won't learn much !",1
duolingo,would be great if it had a speaking only option and a written option as i feel speaking it is more important than reading mostly.,1
duolingo,"one drawback for me is, (in italian) the lessons aren't comprehensive.",1
duolingo,"three or four verbs are introduced (sometimes without all the conjugates, which makes irregular verbs difficult), but the exercises will ask for dozens of verbs that weren't introduced.",1
duolingo,"while it's a great pp (and i use it enough to use the paid version), i still need a notebook to write down and learn verbs with all their conjugates, along with all the glances of the language.",1
duolingo,the lessons could stand to explain certain things a little better though.,1
duolingo,like each lesson should have a little into that lays out what will be covered.,1
duolingo,i would like it much better if there is an option to turn the writing portion of the language you are trying to learn off.,1
duolingo,just needs more words in every category possible :) thanks,1
duolingo,i noticed that you don't learn the alphabet yet.,1
duolingo,it feels slow paced as i expand my french vocabulary.,1
duolingo,but now i am very disappointed in the lack of lessons.,1
duolingo,you would get up to 20 lessons at the higher levels which is good for retention as repetition is key but now you only get 4 for each level and that is ridiculous.,1
duolingo,"ok, this pp is a great free language-learning pp, but i just feel like it doesn teach you correctly sometimes in the exercises, and it doesn't give you too many tips during the lesson either.",1
duolingo,so if you have the patience and willing to dig for some answers when it marks you wrong (even though 90% of the comments from other users on the pp show that your answer was the same as theirs) you might really enjoy this pp.,1
duolingo,"i wish the lesson would explain a little more, but the community is so friendly and willing to teach it makes up for the lack of content in the lessons.",1
duolingo,"i really love the pp except for one piece, the health.",1
duolingo,"i get they are trying to push the premium service, but the webster doesn't employ this feature and i can learn all day.",1
duolingo,but if you get into a lesson you struggle with on the pp your health can run out before even completely finishing a single lesson.,1
duolingo,"in the scottish garlic, for example, the mention rules aren't explained properly.",1
duolingo,"the incentive to practise leagues regularly are mostly positive, except for the 'leagues' feature.",1
duolingo,can run a bit slowly on my phone.,1
duolingo,"the occasional bug making lessons impassable, very rare, i've only seen them in practise mode",1
duolingo,"but the errors, the lack of some vital information while learning and the pure translation-focus of the pp takes away from the learning experience in my opinion.",1
duolingo,"but, maybe it will be kind lots of as and makes you send some money on the better version.",1
duolingo,i hope do further develops 'stories' to help with immersion.,1
duolingo,"the reason i took off one star is because it's a little straight forward, and when you're still learning the alphabet or something, the next thing is something you've never seen before.",1
duolingo,i also don't like the lives/hearts and how you have to wait to refill them.,1
duolingo,"please, i can do audit lessons.",1
duolingo,he cannot start recording somehow.,1
duolingo,"and please, add a lesson to learn the symbols of the language, letters, anti, etc.",1
duolingo,"i love it so much and it helped me a lot learning a new language but the"" hearts "" take a very long time to refill that lead me to quit the pp and i wish u would look at this matter and make it better!!",1
duolingo,"i wish the progress was faster, but the pace seems related to my demonstrated proficient.",1
duolingo,the only thing missing is some explanation of theory.,1
duolingo,"love this pp, it's very useful for learning all types of different languages, it's very useful because i am using it for school, i just wish you didn't have to pay to get more unlimited hearts, or just make it so you have more hearts, beside that it's a great pp.",1
duolingo,"has helped me for sure, but small criticism would be that it is overlay repetition.",1
duolingo,"repetition bread familiarity, but i feel it can be too repeititve.",1
duolingo,perhaps an algorithm to measure how many times you got something right or wrong could be used to progress quick earners more quickly?,1
duolingo,"superb but try to avoid repeating the same sentences in the same lesson several times, it becomes very boring in fact, try to use the words you want me to learn in different sentences to avoid making anyone feel boring, and one more thing, each lesson have many levels, try to make each level is especial and make me feel that i learned new thing even a new sentence",1
duolingo,"my 25 day streak disappeared, and the cut moscow was left crying in my into.",1
duolingo,i love using dueling but sometimes it takes so much to load the lessons and sometimes it can load them:(,1
duolingo,problems with timing of the speech function makes me miss words on the pp that i didn mispronounce,1
duolingo,the latin course forces you to an english sentence structure for translations.,1
duolingo,"i like the pp, but honestly the passive aggressive modifications get on my nerves.",1
duolingo,if you skin a day the modifications get sappy.,1
duolingo,at times want hear any of the audit but it might be the fact that i have a happy phone otherwise great pp.,1
duolingo,"but i think the process is a bit slow :/ waaaayyy tooooo slooowwwww that instead of pushing myself to learn, i get bored and annoyed.",1
duolingo,"i am almost done with most of the levels available, not sure what happens next and if you need to pay to get to further levels.",1
duolingo,there is a lot of repetition in the lessons which seems to limit the amount of new words that could be introduced under each category.,1
duolingo,its mainly learning vocabulary and not verb conjunction.,1
duolingo,occasionally have issues with lessons loading up and there have been a couple of the speaking questions that wouldn't accept your answer unless it was in english but all in all it's a good pp.,1
duolingo,"it doesn't do much to explain some of the santa and the voice speaks too quickly when you do some of the audit tests but for a free pp this is very, very good.",1
duolingo,"the pp is enjoyable to use and motivation, but you need to get a book with some grammar in to understand the rules of the language",1
duolingo,silly types can get annoying but overall awesome product,1
duolingo,teaching methods are great but please add rude to the languages taught.,1
duolingo,"also, if the tips contained a list of all the vocabulary taught in lesson for memorizing it would also help (ex: for japanese, all the letters with their pronunciation).",1
duolingo,"a fun way to learn, however the pp could use a glossy of words you've learned, as well as a proper pronunciation guide.",1
duolingo,"i can copy the voice perfectly, yet the pp still won't register that i've said it correctly.",1
duolingo,"it's a good start for a new language, but the audit seems to cut out for no reason periodically.",1
duolingo,there are times when i must select words and i can't because they don't fully appear on the screen.,1
duolingo,it lacks a bit of depth to explore the grammar or actual dialogue to listen to and learn from.,1
duolingo,"if you get like 5 wrong on a lesson and you don't have domingo plus well ,your heart will have no lives and you'll have to wait 4 hours and about 23 minutes.",1
duolingo,lessons sometimes start without giving you enough information such as using words not previously taught.,1
duolingo,would be nice to have a vocal library to keep track of words you've learned so far.,1
duolingo,i prefer to press on the words because it's quicker and my keyboard on my phone is not the best.,1
duolingo,i wish it let you practice the so each part more.,1
duolingo,"it's has helped me learn the basis so far, but the only small complaint i have is knowing how to resume where i left off in the lesson.",1
duolingo,i would say the pp isn't well organized in the home screen.,1
duolingo,could say don't like the whole set up and everything for leveling and act ..,1
duolingo,"nice application, very interactive, but i would have loved it more if we could possibly be able to do an online quit competition with our friends, would be nice.",1
duolingo,however i have encountered stitches and reported it but never received any sort of response.,1
duolingo,"the pp interface is awesome, but for some languages like makarin, i feel that it is not beginner friendly.",1
duolingo,it's more of an intermediate practice for people who already know the basis in my opinion,1
duolingo,team domingo please give an update with essaying feature as soon as possible,1
duolingo,i love this pp but i find one fault in it that i couldn't talk to native speaker .,1
duolingo,my only suggestion is to design better contents for the lesson you work on and some more detailed explanations as to why the answer is right or wrong,1
duolingo,"i love the pp and it reaches me a lot, but i am still learning a language and whenever i get a word wrong i lose health points and you have to do a lesson and get them all right to earn back health points.",1
duolingo,con: would like to see explanations of grammar.,1
duolingo,"however, because we have to have hearts, it slow down learning progress.",1
duolingo,"domingo, please can you stop the hearts as they let down your pp.",1
duolingo,the pp is great but sometimes the voice just stops working,1
duolingo,i just have a hard time hearing the sounds.,1
duolingo,"i use a phone and tablet, phone pp has more oral exercises.",1
duolingo,as an australian some of the american usage is frustration in translation.,1
duolingo,"it is a good pp to learn languages but lately it has problem doubling the lights, it supposedly to watch the adv for few seas but turns out the screen goes all black and stuck.",1
duolingo,just that there are some specific languages which could be involved like martha but other than that it is all awesome.,1
duolingo,what i hate is that you have to complete the day's lesson by midnight in order to maintain your streak.,1
duolingo,"good free pp, as are a pain but can get rid of if you pay plus you can also get unlimited hearts, but if your like me and don't like paying for extra you can still learn extensively without a problem using the pp",1
duolingo,"issue is, i cannot add my friend so that we can track each other's progress.",1
duolingo,"awesome way to refresh a language, but i find that if you want to learn from scratch, you should supplement domingo with some other textbook or learning software.",1
duolingo,"the hearts are a bit annoying, and i wish the pp wasn't so push for you to get pro, but otherwise it's great.",1
duolingo,i do wish there was a tax for explanations of things like why the same word can be spelled different ways.,1
duolingo,"i also appreciate the i, the only thing is i wish the domingo podcasts had a tax in the pp rather than a separate webpage.",1
duolingo,"really great pp for free use, but they may need to review some of the rumania phrases.",1
duolingo,would've been great if you add latin.,1
duolingo,and also add an option wherein you look for someone to chat in order to practice your language.,1
duolingo,"and yeah, can you add a feature where we can save tips office?",1
duolingo,it just dont have many explanations for the usage of words.,1
duolingo,might be useful if they put how a word is used in grammar properly.,1
duolingo,i think it could and should be one of the apes that you don't need to connect to internet for it will be nice for that otherwise great for kiss and adults.,1
duolingo,"somewhat repetition, but can move forward easily.",1
duolingo,should be some explanation of towel usage.,1
duolingo,"lessons move along a bit quick for me, need more time to learn the symbols(letters) new words are not well expressed before expecting you to know them.",1
duolingo,amazing pp but sometimes the formulation of the sentences seem weird and also in some cases they ask you to translate something and it is just a name that you have to write like : hallo hans > hello ...,1
duolingo,it is sad that there is no feature to switch the default language.,1
duolingo,"my first language is russian but my phone is set to english, so the pp is also in english which makes it really inconvenient to learn.",1
duolingo,"it's so useful but i have a major problem, none of the listening tracks play on my phone so i can't answer them, by the way i gave all the permission, what should i do?",1
duolingo,this is very nice but my only problem is i can't find friends.,1
duolingo,i notice that some things aren't explained clearly.,1
duolingo,"a few things here and there that aren't exactly translated right, but i'd like to think it's more of a difference in dialect.",1
duolingo,it seems that the recent few updated made it work worst.,1
duolingo,why suddenly the pp became unstable?,1
duolingo,"it masses up up points, days, the number of lessons done and leagues.",1
duolingo,i do not have access to listening and speaking tasks...,1
duolingo,"great pp, but it would be perfect if you'd add the grammar explanations and stories in the other languages besides german, french, english etc.",1
duolingo,i do wish it would challenge me a little faster though.,1
duolingo,"but in learning arabic the font of assignment is very small, difficult to read, especially for a beginner.",1
duolingo,.....except that sometimes has problem with its audit system.,1
duolingo,would be easier though if there was european portuguese because it's not the same as brazilian.,1
duolingo,after the last update the pp sometimes doesn' t count your progress.,1
duolingo,also in somehow losing the gems by no means.,1
duolingo,good pp.... i would prefer if the pp had an explaining feature towards grammar/vocal so i could better understand why the words are in the order that they are etc.,1
duolingo,i updated my pp but there is no sound for vocal quires when u tape the sound tape,1
duolingo,"it's a good pp for learn basic vocabulary, but it's just work on the beginner level.",1
duolingo,"for some reason they make a louse japanese course, not even covering all the hiring and giving zero lessons for katakana which is essential to learning japanese... you need to have some kind of rd party study aid for these and other asia courses if you want to learn them in depth and not just play a game (>.>) be it a text book, character chart, etc, which is totally unnecessary.",1
duolingo,"there are better apes for asia but if you're interested in a european language, this application is a must have!",1
duolingo,"pretty good, except the first time i download it, i disabled it because it wasn't working very good...",1
duolingo,domingo is a great pp for learning a new language but you have to pay in order to continue learning without any interruption like hearts or as.,1
duolingo,"good pp, just takes too long to get to an intermediate/senior level for when you already know basis and want to learn more complex sentences.",1
duolingo,just wish it had dark mode for those late night sessions before bed.,1
duolingo,"it didn't didn't hello with grammar, just sentence structure.",1
duolingo,i love this pp but but there are some things i don't like about this pp.when i get things wrong my heart goes down and later i have none so its hard to play sometimes.,1
duolingo,"the pp is great and i'm learning 2 languages at one time, but the adds are a little ridiculous at times.",1
duolingo,"it's a little childish, and i wish i was learning more useful language for traveling, but i bet that'll come.",1
duolingo,might be better if the developer add some more exercises to practice speaking.,1
duolingo,good pp but does not explain the grammar rules.,1
duolingo,requires a little research outside of the pp to progress in some of the lessons.,1
duolingo,mixed voices.,1
duolingo,get annoyed with the rewards though.,1
duolingo,in all honesty the adds get annoying.,1
duolingo,quick update: i wish it told you how many minutes and hours total you have been practicing.,1
duolingo,"when i lose all my lives, i just want to keep going!",1
duolingo,don't know what happened though but after one of the recent updated i can't recorder the words in word bank mode anymore.,1
duolingo,also the tests to skin a level are sometimes too easy with most translations providing the word bank!,1
duolingo,(wish there was a portuguese from italian!,1
duolingo,it's really adjective and if you are competitive person you have to be careful.,1
duolingo,"but one thing, i wish japanese lessons had stories, it would make everything so much more interesting!",1
duolingo,but i would like to make a suggestion: it would make it very simple for me at least if there was a dictionary of the language i'm learning in the pp.,1
duolingo,"learning with this interactive environment beats all other methods in my opinion, and i wish that domingo would take the lessons to even more advanced levels as well.",1
duolingo,"one extra plus is the sensible approach to audit support: when audit is not a good idea, you can practice with text only.",1
duolingo,"can't be used by itself for language learning, but as a supplement it is my favorite pp.",1
