app,ratings,helpful-vote,comment
duolingo,5,241,"brilliant pp, only a few minutes a day, easy to fit into your day, very happy at how quickly i've been able to brush up on my french. very efficient way of learning... french to english translations, english to french, listening to french pronunciation, missing words and practicing tense. i know loads of people, young and older, who are trying the pp. huge language option. i like it that you can set up how many minutes a day i want to practise."
duolingo,5,56,"if you give it serious time (not 5 minutes a day like they advertise, but more like an hour or two daily), this learning method actually works well to get you started with a language. the gazing mechanics keeps you coming back for more, it's fun to compete on the leaderboards and in a couple of months you'll start to understand and maybe even basically speak another language!"
duolingo,5,25,"amazing learning tool for those who want to set a foundation for learning a language, me personally chose russian and i feel like i am learning a good amount, you just need to dedicate time and effort, i also recommend tiny cards and then follow the language you're learning to help practice and perfect the language of your choice. hopefully i will have russian killed in eventually. just need to put in the work. overall, great free pp and i love domingo!!!"
duolingo,5,1,"love this pp. i've tried at least a dozen others, and every one of them would only let you progress so far, or do so many lessons, before having to subscribe. i've been able to access everything i've worked towards, and had clot of fun doing it. i would, and have, recommend domingo to anyone looking to learn another language."
duolingo,5,0,"so far, so good. i am still in the beginning/into, so i dont know how much will be locked behind pay walls, but it's great to refresh basic spanish skill. the little owl us so cut and encouraging that even as an adult, i feel like i'm making progress. my only complaint would be that it is spain spanish, which is different from mexican spanish, but it's definitely a starting point."
duolingo,5,119,"fantastic! it's such a fun way to learn a language, i absolutely love the story telling addition and the little details everywhere. it works, i went from 0 french to pretty much somewhat proficient, and i still got a long way to go to finish the course! adds are very fairly placed and completely unobtrusive on the free version as well, thank you domingo! this is an pp clearly made by a developer who cares. russian, you're next ;) i just wish each lesson was a bit longer though."
duolingo,5,10,"a wonderful and revolutionary pp. making fun out of learning through ratification. wonderful use of visual and audit clues. does a great job keeping you engaged and interested and it really works. wonderful to use before to study up for trip abroad. where's the pp that makes learning history, path, or other subjects fun?! thank you for your service and helping those who commit to continuous learning and growth."
duolingo,5,6,"i am conversational in japanese. however, this domingo pp is teaching me words, phrases and some structure that is new to me in the language. also, i use this pp to learn the written language (anti). which i am really enjoying!! this pp is not just for beginners. those of us who speak the language can benefit as well. thank you domingo !"
duolingo,5,3,"this offers opportunities to learn in many different style. between needing to speak it, having to translate it both ways and needing to write what you hear. it build on top of itself at a good place incorporating words from past lesson and incorporating new words in an easy to understand concept. i am excited to use this pp to learn as i move to south florida and hope to become client by end of the year."
duolingo,5,3,"an excellent language pp. fun to use. each lesson has tips which are useful. lessons depend on the category chosen & can be phrases in your home language & the language you are learning, write what you have heard, speak the phrase or word, enter missing words, vocabulary. it is an easy way to learn a language & you move up or down in leagues pitted against each other. see which languages others are learning. complete as little or more daily or less frequently, easy to pick up again."
duolingo,5,11,"wonderful pp. makes learning a new language a since, even better than university and much cheaper! courses are $600 for 4 months while i paid $66 for 6 months and i learn on my own time. plus no exam! many different exercises to help you learn rules and lots of repetition to help memories the material. the pp makes it fun like a game. much easier to learn than babel. i speak 3 languages already and i plan on learning 2 more after this fourth one because the pp is so easy and fun."
duolingo,5,4,"great pp. i am learning spanish and it is really helping. i struggle with profound and this is really helping me. the lessons have a nice mix of reading, listening and writing. and the progression is nice and slow. i had to download a dual language keyboard so i do the writing properly. i can wait to go to spain and practice what i've learnt"
duolingo,5,4,the pp uses just the right amount of one's base language to get you started. then one hardly notices english even when you're doing a translation exercise. it has an element of multiple choice exercises. it can be very easy if one sticks to it and just demanding enough to make learning a language a pleasure. at one point it replaced solitary as my go to pp when on 20 minute bus rides my advice to all is to bite off what you can chew. chew it over by a little real world practise.
duolingo,5,2,"very nice pp! i'd like to point out a few suggestions i personally would like to experience in the future inside your pp: one is to be able to search for a word's meaning (you remember a word in german for example, but you're not sure about its meaning..), and second thing is to be able to see all the words you have learned so far, with its translation beside (all=all..) other than that, appreciate your work, useful pp! thank you!"
duolingo,5,8,"in all honesty the adds get annoying. but for a free pp, that genuinely reaches you the language and how to spell and pronounce things correctly. it is great. there really are no shortcuts and you have to stick with it. if you want to learn a language you can. this pp is great and makes it easy to get into your routine. just beware of the owl if you leave your modifications on. he will remind you. quick update: i wish it told you how many minutes and hours total you have been practicing."
duolingo,5,1,"best and most information language learning pp. i have been using it for a couple years to learn swahili. it has been improved over the years to be more user friendly and accurate to the languages they offer. i never get bored of it! the interface is fun and game-like, and you actually will be amazed at how much of your chosen language you begin to retain and grow client in! i would recommend dealing to anyone wishing to learn a language."
duolingo,5,1,"i am having fun regarding on learning a different language. it really uplifts the mood and makes a very efficient time killer. 5/5 even with the as, it's not a bother and some have like a benefit on the long run like extra gems. i won't say that a premium version is obsolete but rather i would like my language tutor to be as free as possible given the fact that different language materials and tutorials are scarce on the internet these day and age. wonderful pp thank you des!"
duolingo,5,7,"this hands down! the best pp i've ever download! i'm learning several languages, and domingo makes it easy and fun! you get weekly updated on your progress, there's a store where you can buy stuff with the gems you earn...all this with the free version! i'm seriously considering upbraiding to the pay version because, if the free version is so great, i bet the upgrade is even better! as are not irritating and easy to close, too. highly recommend!!!"
duolingo,5,1,"i love this pp. i have been using the free version for 2 weeks and have learnt so much already. it reaches you how to read, write and speak the language in a way that's fun and easy and encourages you to keep going. you can also clock stories which help with your reading and listening. couldn't recommend enough for someone who wants to learn a new language"
duolingo,5,2,"easy and engaging to use. i'm on day 7 and can already recognize arabic letters and the sounds they make! i'm old so it is exciting that my brain is learning so easily with domingo! i like setting my own goals, and am very happy that there are plenty of practice sessions included with my plus version. i highly recommend this pp."
duolingo,5,0,"i really like the pp as additional practice method. combined with a proper course and book for grammar it's a great tool to study whenever you got a few free minutes. i would recommend to try it, if you want to learn a language, the i still suggest to use other sources, like books, native speakers and courses, as well."
duolingo,5,1,"this is still a great language pp. although it doesn't explain certain rules out exceptions so if you're serious about learning another language it's best to have a book or some other more detailed information to hand. however, i would recommend this to anyone wanting to either learn, or just find it about another language."
duolingo,5,1,"i have been using the pp for a week and so far is good. learning is broke up in different categories and uses repetition and adding the old stuff into the new stuff to remember the words. i am learning spanish and german and slowly starting italian. with many option, it's easy to learn a new language at your own pace."
duolingo,5,11,"i think domingo is absolutely wonderful and helpful. i've been learning spanish for a few weeks now and the is so much content that i have covered. many of the reviews mention the 5 live system and i believe it's a great thing because there is also a 'practice' section which makes you revise what you have learnt in order to get lives. although it's time consuming, it tests your knowledge and ensures that you are learning as much as possible."
duolingo,5,1,"this pp is very fun and educational. it makes learning a new language easy and fun! when i lose all my lives, i just want to keep going! and i also appreciate the pp being free, along with all the languages and lessons! and there aren't many as either! i would give you 100 stars if i could. i really appreciate this pp."
duolingo,5,1,i learned a lot from this pp. gracious. this pp is the best to learn a certain language. i hope that you will have a vocabulary words so that we can review some of the words if we are not up to answering questions. the books of the pp is also very helpful. thank you so much for making this pp free and giving us opportunity to learn a language easily!!!❤❤
duolingo,5,0,"i use this application as a supplement to broader self-study tools, to reinforce grammar concepts and pronunciation. it works incredibly well to foster a deeper understanding and more natural learning curve of the language being studied. incredible pp, and so grateful that it's all at no cost!"
duolingo,5,3,"it is an amazing pp. a little expensive for premium, but if you can ignore the adds it's awesome just using the free version. i feel like you will definitely need more than just this pp to learn a language, but it definitely will get you on your way to an intermediate level. it's fun, easy to use, and gets the into in your head, so i rate this 5 stars. it also has a small competitive aspect to it that i have really enjoyed."
duolingo,5,0,"well, it is not a bad application... i mean, it is too similar to a game but if you pay attention and follow the advice the pp itself gives (read each lesson out loud and write the new vocabulary you learn after practicing), then you will probably get the basic knowledge such as sounds and simple vocabulary. so, it is recommended to beginners but you can't stop here."
duolingo,5,1,"i love it. especially for a free pp there is lots of content so i don't feel the pressure to upgrade just yet. one thing i would like to change is how they teach grammar rules. it seems like they only test you, but never give you a lesson beforehand. so you end up just blandly guessing until there has been enough repetition that you catch on to the rules."
duolingo,5,1,"the best pp on my phone. good difficulty curves, content and it is overall very cleverly written pp. i only wish they expand the section with stories and maybe at some level make the stories into audit-so you have to listen to a few paragraphs and answer questions based on what you heard."
duolingo,5,2,it is an extremely useful pp if you want to learn any language correctly and practically. it isn't just about the written part of the language but also pronunciation and phrase forming. the method of teaching is great and subtly repetition which helps memories very quickly. i absolutely recommend this pp for new earners of any language.
duolingo,5,1,"i love this pp, i only wish sometimes there was more guidance and explanation on specific things. i usually end up having to look things up for myself, but that doesn't bring my rating down because without the pp i wouldn't be knowing what i had to look up in the first place edit: i forgot to mention that i love the webster more than the pp, if the pp was more like the webster that would be epic"
duolingo,5,4,"i would highly recommend this as a method of learning a second language. it is engaging, fun and effective. the repetition is very helpful for retaining new vocabulary and hearing the sentences is great for learning pronunciation. i have learnt more grammar in a very short period than i have with other language learning software."
duolingo,5,18,"this has been a great way for me to brush up on my language skill. i love the extra components like the podcast and the stories that are interactive. it has become a daily ritual for me and i don't see myself falling out of practice any time soon. the only buggy thing for me are the pronunciation exercises. i'm not sure if it's how i am holding my phone, if my mouth is too close to the microphone or what but it gets disheartening ""failing"" those activities with no help in how to correct."
duolingo,5,0,"love domingo and my portuguese is getting so much better! don't know what happened though but after one of the recent updated i can't recorder the words in word bank mode anymore. also the tests to skin a level are sometimes too easy with most translations providing the word bank! other than that, this pp is absolutely great! (wish there was a portuguese from italian! the two languages are so similar and it would be much easier to learn being italian my first language!)"
duolingo,5,0,"amazing pp, easy to use, huge variety of languages to learn, doesn't overwhelm you. i love that you can not only access it on your phone but also on a computer. extremely simple to use, i love how it works with your pace. i can't recommend this pp enough, nor can i express how much i love this pp."
duolingo,5,0,"very nice pp. it's really adjective and if you are competitive person you have to be careful. there are a lot of things that might be useful if you are learning new language. it is easy, funny and useful. highly recommended this pp when you are learning either at home or outside."
duolingo,5,0,this surely is the best free language learning pp available. it makes learning real easy and fun. it has as but at a minimal but you don't have to watch them so its not bothering you. plus it keeps you motivate and its just amazing. you can set the bar low but when you start you almost dont want to quit. so in my opinion its definitely worth a try!
duolingo,5,5,"domingo is fun and interactive. i have been using this pp almost daily for over a year now and i am comfortably starting to converse with my spanish-speaking patients. i love how many different ways of learning it includes. it appeals to my hands-on learning style and the visual eye. there is lots of positive feedback, encouragement, and rewards. domingo is helping me meet my language goals in a very positive atmosphere."
duolingo,5,0,"loving this so far! i'm 31, and hard of hearing failed french in school because i was unable to hear certain sounds / so reporting it back i was always wrong. i find this so much different i put my earphones in and i'm able to fully hear the sounds, and therefore i've been able to repeat it back correctly. it's nice being able to learn something that i was told i would be unable to do. and now at the age of 31 i have friends who are french so i have even more of a reason to really try to learn"
duolingo,5,0,"organ lessons are getting much better. it would be great if the pp would do a better job when listening to me speak (sometimes i really mess it up and it can't tell) but otherwise awesome! overall though, i'm generally really happy with it."
duolingo,5,0,"comprehensive. the little lightbulb icon next to the individual skill (on some interface, instead of a lightbulb it's ""tips"") provide lessons (grammar etc.), giving it great structure. wide selection of languages. i use it every day and makes learning languages enjoyable. can't believe it's free, i highly recommend! (:"
duolingo,5,0,"domingo is a great pp for learning, absolute 5 stars, its great, i love it, the lessons are very intriguing and i love, just love the cut little animation on the lessons, when i'm doing my japanese lessons, i always loved the lessons little pictures, but those little animation are perfect! yes. but one thing, i wish japanese lessons had stories, it would make everything so much more interesting!"
duolingo,5,1,"i love the pp because it is friendly towards you and i have already after 15+ minutes learnt a fair bit about german! i have always wanted to learn german and now that i am, it feels great! this pp isn't time consuming and you can get on and off of it at any time you feel comfortable, and depending on how often you use the pp, you could learn a whole new language in no time! i highly recommend this pp to anyone who would like to learn a new language! :)"
duolingo,5,0,"was expecting something that gave u the basis them u had to pay to go on, so happy this isn't the case! it's really good and allows a varied method of teaching , i love the competition with up and story mode. so helpful for learning a language. it unlocked new material as u go on so i don't feel overwhelmed with words but a fast enough teaching pace to develop with. best pp for this i've found."
duolingo,5,0,i am really enjoying the ratified experience domingo brings to learning a new language. i appreciate that it has the listening and speaking parts so strongly integrated into the lessons. i'm impressed that it can hear me speaking even in noisy situations. a very enjoyable pp.
duolingo,5,0,"i started using domingo just over 30 days ago and am quite impressed with the format and intuition nature of the program, as well as the additional materials such as podcast to enhance and enrich the learning. i am very happy with this pp thus far."
duolingo,5,0,"very good pp except for some reason computer experience seems more thorough. get stories for japanese! sometimes you want a bit more emphasis on the lists of words you've already learnt, and it would be nice to understand the different numbers next to surnames on the forum."
duolingo,5,3,this pp is great for learning a language their are such a small amount of as it never others you and besides you choose when you watch video as for doubling stuff like gems or hearts. some people hate the hearts in this game you get 5 every 25 hours and each time you mess up in a lesson it takes away a heart. when you run out of hearts you fail that level of the lesson and have to red it which i am perfectly fine with as you can do practice lessons for more hearts. helping you too learn!!
duolingo,5,0,"a wonderful learning platform.......step by step lessons.....enough of practice to make you remember everything that you have learnt.....it reaches you reading, writing, speaking, listening, all of them.....and the best is all of this is completely free......must use pp"
duolingo,5,0,"domingo is simplistic in approach, but that simplicity by no means a detriment. its design makes learning a fun and easy experience with achievement milestones to track your progress and a subtle aspect of competition by way of leaderboards that display others' progress and banking. domingo makes you want to learn more, to progress, to better your understanding of whatever languages you choose to learn in a brilliant fashion. buds to the creator!"
duolingo,5,0,"i never expected that learning a new language could be this fun! i don't use it often, mostly before sleeping, but it's fun to learn the new language to prepare myself for trips or when i encounter a random spanish person (guess what language i'm trying to learn). i also see some reviews complaining about the ""new"" hearts system. bull i say, it has always been there!"
duolingo,5,19,"brilliant pp. free and easy to use. does have as but they are very short. great content and easy to learn, tests your skill on speaking, listening and writing the language. i'm learning french at the moment but there is loads of languages you can learn and learn several at once. you earn up when learning which takes you up the leaderboard against other people. i highly recommend this pp as i've learned so much already!"
duolingo,5,2,"i've compared other apes to this one and i'd love to say, bravo! i have not learned much but i get words in my head quickly unlike the others. it doesn't usually crash and it's got good speed! and i like it that you can study like 5 languages at the same time not like the other apes. спасибо!"
duolingo,5,5,"i think this pp is very helpful. i studied makarin in college for 4 years, and this gave me an aptitude test to clock lessons starting with my level of proficient so i did not have to start from the beginning (i still did for review's sake, but it was nice that i did not have to). this helps me keep my makarin decent, and it reaches me some phrases they did not teach in school. i also appreciate that it helps me with my reading quite a bit."
duolingo,5,14,"fun and information application for solo learning, complete with vocabulary, grammar, audit clips, conversations, stories, and statistics for friendly competition between other students. better than public school! best part is that this is free and the as are not intrusion. thank you for making language studies accessible and free across the globe!"
duolingo,5,17,"lately i am once again falling in love with domingo. i love this last update! the fact that the keyboard switch automatically is a really good way of saving time, especially when you have more than 10 keyboard to chose from. finally they changed the number of lessons too! it was a bit annoying having to do 20 lessons to complete one level. and i love the podcasts, learning french has become more easier for me, that i was struggling a bit with the similarity to spanish. absolutely advised!"
duolingo,5,2,lui it.. such a wonderful pp❤️.... which helps me to understand the concepts very easily.... and it also sends me reminder modifications which reminds me most of the time..!! tax to domingo i suggest that many pp can use this pp and learn many languages! domingo also provides us the interest of learning a new language. do the best learning pp for languages..!
duolingo,5,0,"great pp to learn almost any language you would think of. it's completely for free which is amazing. you will just see few adds which is completely understandable (or you can pay to not see them). i love the learning system, lessons, everything. also the domingo forum is amazing help. thank you so much!"
duolingo,5,0,"simple to use pp. the ease of use makes it fun for me to learn a new language. the leaderboards make it competitive so i am always logging in to see if i'm still top three. there are as, but they are short and easy to exit out of once one pips up. i would recommend this pp to anyone who wants to earn a new language."
duolingo,5,0,"i really love this pp soon much, aside from the fact that learning is free i can learn many different languages in this pp. ever since i found it in the internet on ways to make your time more worth it using my phone. it makes my learning easy than any other up. it reaches how to write, pronounce, how to contract a word and many more 💓 i highly recommend it to all the people i know through out these past 5 years 😁 thank you so much domingo team!! 💯💓"
duolingo,5,411,"amazing pp that is so easy to utilize. there are so many many different style of puzzled to truly help the learner understand the structure of the language. amazing! update (01/07/2020). i still give this pp 5 stars. having stayed diligent in learning spanish with domingo, i have truly picked up the basis of the language, making me able to write basic sentences with ease. honestly, i can't believe it's free, this is high quality stuff!"
duolingo,5,25,"this pp has been wonderful so far. they do such a good job not overwhelming you with too much material at once. the lessons are short(2-3 minutes) but you can complete several in a row if you desire. even in free mode, there is exactly 1 ad at the end of each lesson, and you don't have to wait 5, 15, or 30 seconds to close it, you can x right away. that shows class (ll), integrity, and a education to learning from the developer. i was offered a week trial of domingo plus, will def porch."
