app,ratings,helpful-vote,comment
duolingo,5,0,great pp and you get a good amount of tools for free. the only issue i have is that for languages i've studied before its hard to find the right placement for myself. some skill are high level other parts low so i don't know how to assess myself. the tool itself is wonderful!
duolingo,5,0,"it is a great software. but i have a request. i didn buy the software but using it by watching adds.can you please let us use the nodules office which ever we already completed (because, as we have already supported your good pp by watching required number of adds for those completed nodules)...i think in this way you can more promote your good work towards free education. thank you in advance..."
duolingo,5,0,"i am finding the pp easy to navigable. if you're not a paid subscribe there is a free practice option that gives you extra time to really learn what you have done during a lesson, when you run out of hearts. it is great so far! i am learning and pretty quickly it seems. i love this pp so far!"
duolingo,5,0,"i love this pp. it's so much fun, smart and easy. and i am really learning! si, si, es may buena! here's an update five months later: i have been using the plus version and practicing daily and have learned so much. i highly recommend this program."
duolingo,5,0,"i'm not very good with learning new stuff but this has helped me beyond my dreams. i know many people can just go and not look back but i have to frequently go back and do it all again and again and again. and i'm able to keep visiting the areas i need to the most. thank you for making a program that i can work on at my desire. i know there are others like me out there, well this is what you need if you truly want to learn other languages. good luck and keep going forward."
duolingo,5,0,"it really helps with learning a language, if you want to learn a language for free just click on the pp."
duolingo,5,0,"this a well designed pp that not only reaches you a language but encourages you to keep practicing skill you've already learned so you don't lose them. and it does it all for free. yes, there are adds but they don't take away from the experience. i'm having fun learning a language and i didn't think that would ever happen."
duolingo,5,0,"easy to operate, mostly very accurate - a boon to learning a language!"
duolingo,5,5,"a current difference with the desktop version is that it costs five lights to test out of a level, but you can also earn double lights for watching an add. the desktop version currently costs no lights to test out, and there are no video as. if you are in bed you can tell it you can't listen or speak now and audit questions will be suspended for an hour. once you hit checkpoint one you can read stories. in the german course they are cut and humorous. the whole learning experience is great!"
duolingo,5,0,"i think it's awesome, i'm really learning! there could be more peaks with the paid version though :)"
duolingo,5,0,"a very smart pp. play with a benefit, learn in an easy, fun way."
duolingo,5,2,"it's great, but i wouldn't call it perfect, however, for learning languages like german, english, swedish, russian, chinese, arabic and more, domingo is perfect for getting a very good understanding of whichever language you're trying to learn. and i appreciate them having option like naval and hawaiian, so domingo, rock on!"
duolingo,5,0,"this is hands down the best pp or technique i've used for learning a new language...i did rossetta stone for months and only retained a fraction.... still early in getting serious with learning, but so far i'm finding myself recognizing things and instantly translating them not just remembering that a symbol means something in my native tongue but actually picturing the thing in my mind sans english word!"
duolingo,5,0,i like the pp they make it easy and fun to learn and they really work with you in trying to progress.
duolingo,5,2,"having been using it for more than one year, i am really impressed by domingo for its concise and smart layout, systematic course design and various incentive to help you progress! recently i just got the new offering of short stories, really love it! the stories are funny and very useful!"
duolingo,5,1,"native english speaker in the us. i've been using domingo for years! after i took german in high school, i wanted to continue learning. the most recent update added ""stories"" & that has been the best thing it's ever had. this let's you read, & hear, a realistic conversation between people. the words can then be tapped to review what they mean, & you learn a lot through the context! i've been very pleased with it as a basic learning course, but be sure to use external material to learn!"
duolingo,5,0,"like that it provides exercise with different language skill, including not only vocal exercise, but also listening and speaking practice. like that it even has speaking practice with a voice detection function to see if the pronunciation are correct. would be great if there are more advanced levels of learning."
duolingo,5,0,honestly a fun and easy way to learn something so very very valuable!
duolingo,5,1,just started as a beginner but so far it seems to be teaching in a way that i retain because i am already able to use what i have learned to start communicating with my much more advanced wife. it is very fun so far. you have to remember to fill your heart health to make sure you don't lose your progress!!!
duolingo,5,0,absolutely amazing! i love this pp. it makes learning languages fun and effective.
duolingo,5,3,i've only been using domingo for a few days but i enjoy every second. it can be quite repetition but i'm sure that's why it's effective. the way the exercises vary in format help with true comprehension. so far i love it! will probably pay for the plus version without adds.
duolingo,5,0,"it's great. it takes its time to teach you slowly. before each lesson you can click a little icon and it gives you a renown of what you'll be learning. i'm about 1 month into my german lessons and i feel confident that if i stick this out, it would only take a few more months for me to feel comfortable holding a conversation."
duolingo,5,0,love how it progresses in difficulty and provides different ways to learn.
duolingo,5,11,"i like the fact that i can be learning while waiting for the elevator or the train. the step by step and repetition help a lot! and i love the new feature of speaking into the microphone as a test question. that's awesome! i wish i could be taught some words before being tested on them. but often times, one can press on the word for the translation so that helps."
duolingo,5,0,lots of fun and learning a new skill. as adjective as a game. really great.
duolingo,5,1,"wonderful, i'm loving it, easy to use and you have taken many efforts to teach the languages that's really awesome. plus everything's free 😇now. only one concern, please make available more practice for speaking, otherwise learning, reading,writing is very nice and easy to understand. 🌟🌟🌟🌟🌟 rest all the available features are too good🔥"
duolingo,5,0,"i love this pp, i've been on it for about an hour and already know a lot of basic swedish and i find it very fun, i also love how practicing more can get you more hearts to practice more. it makes it really easy and i'm really proud of myself."
duolingo,5,4,i would like for italian & japanese to be added to domingo stories. it's a pretty useful tool. i've been using it for spanish & it helps me better understand the language more than the regular way of studying with domingo. the regular way is also good. but seems like more of a way to reinforce what i've learned for me. so i wouldn't want to get rid of the regular way.
duolingo,5,0,"nice pp, learning easy and fun and helps to learn different languages and u can take 4-5 languages at one account, the best facilities of this pp are we can take many language on one account, makes learning easy and fun for free, it freeze but get back to normal at 4 seconds! you can definitely download this pp💝💝💝👏👏👏👍👍👍👌👌👌👌 domingo makes learner understand the language by it's source. domingo doesn't contains much as and makes learning easy, fun and you can trust this is best"
duolingo,5,0,"domingo is a really good pp. it was recommended by one of my friend. easy to use and understand the system as well. it'll be better that can connect with friends live, such as live chats, audit calls.from that we can resolve our language matters with natives."
duolingo,5,0,"i love it because the hearts make you focus more and its so easy to learn and how you can learn multiple languages on the same pp its just a perfect pp and i love it and so do all my friends! i shared this pp with my friends and my family ,my sisters are learning japanese and my dad is learning french to!"
duolingo,5,0,"really great! you practice reading, hearing, and speaking ...immersion"
duolingo,5,0,"great: easy to use, fun and thorough at the same time."
duolingo,5,0,this pp has been great. a very easy way to ease into learning a new language.
duolingo,5,0,it was very nice i spend more than oh a day on this pp but now sometimes it doesn't work do not unload pictures and not playing the voices plllleeeeaaaaazzzz fix the buzz
duolingo,5,0,"domingo has been quite helpful, precise and easy to use."
duolingo,5,0,very engaging and adjective. college language classes should take some notes.
duolingo,5,0,great pp for learning a language at your own pace.
duolingo,5,0,simple. fast. easy. just like a language learning pp should be.
duolingo,5,0,"absolute beast. now it's updated like the is version and has all the web features on it. super fun to use to learn a language. but always remember that you need be following a course as well. this application can be used just for learning new words sentence formation, not for learning proper grammar."
duolingo,5,3,"i love this pp, but i do have a few ideas: 1) have personal data (e.g most up earn in one day, longest streak, etc) accessible so that we can compete with ourselves as well as others; 2) give us proper profile pages which could display this data publicly, including information about how long we have been using the pp and similar details; 3) let us set goals, eg no. of crowns in amount of time and give us ways to track our progress on these goals. thank you for putting stories on the pp!!!!!"
duolingo,5,0,"really helpful and instructive. easy to follow with target to aim for. as an older person, whose memory is not as it once was, the lessons are very constructive and encouraging. really enjoy it and would recommend it to anyone to give it a go."
duolingo,5,0,it's a fabulous pp i'm learning french and the way you learn is great with a very good recalling of your lessons ...love it !!
duolingo,5,0,such a great pp. makes learning fun n and unapproachable! i'm hooked :)
duolingo,5,0,"love this pp with the little green owl who misses me if i stay away too long! like my cut little muddy who reminds me to keep practicing my spanish! fun, realistic and practical exercises to get you learning quickly!"
duolingo,5,1,"i like the way this pp makes learning possible in those few little minutes of your day between the bigger jobs. it all adds up. there are a few minor bags in some lessons, but nothing that really inhibit enjoying the learning process. deserved popular and recommended."
duolingo,5,0,"since domingo is so well established and probably the best pp for learning foreign languages, perhaps it's time to supplement some parts with some grammatical explanations about the various linguistic phenomena (such as common tends) for the additional benefit of the learner."
duolingo,5,0,"pretty good pp. but should show the translation of the words you are asked to recognise by sound, as is meaningless if you don't know what they are...and goose doesn't or can't translate either, as that's not that good either! so, you don't improve on the wee words!! otherwise, am enjoying and am learning."
duolingo,5,0,absolutely one of the best apes for learning different lingo.. definitely easy to use and learn from.
duolingo,5,0,"found this pp brilliant to use in learning a new language. good repetition, and introduction to new words plus the encouragement of practice hearts to progress with learning. you can also slow down the speech to make it easier to translate to your chosen language."
duolingo,5,0,great pp. although i am just at the beginning stages of learning it is fun and information
duolingo,5,1,"currently am unable to hear the choice of sounds at the start of each lesson. the audit description comes through fine, but the four option are not spoken once pressed. otherwise great. really like the restore function for completed lessons to ensure you don't leave behind previously learned content."
duolingo,5,5,this pp has been great at motivation me to learn a new language as well as refresh me on languages i've learned a little. i'm also learning new ways to say things in languages i was already familiar with. for beginners i strongly recommend that you click the lightbulb before starting a lesson test. the lightbulb takes you to a page that explains the lesson. most seem to miss that aspect of domingo and get upset when they are immediately asked about words and phrases they don't know.
duolingo,5,0,"i love this pp i am learning french, spanish and welsh and i never dreamed of learning any language. it not got a lot of as and is a fun way of learning. if you want feedback i would add little games in between to help you and to know what you struggle with. one of the favourite apes in my phone. download it now !!! ❤️📱❤️📱❤️📱❤️📱❤️📱❤️📱❤️"
duolingo,5,0,"fantastic pp, very straight forward and easy to understand."
duolingo,5,0,"i love learning on here, it helps with all the relation. one thing i would be nice to add is if there was a section with all the words we learned, definition and translation. so that way for those of us who don't write it down we still have a section to go back to and practice!"
duolingo,5,0,great way to learn or refresh a language. great for daily use.
duolingo,5,1,"this pp is really helping me practice and learn in a simple graceful way! i'm really grateful for the flow of the lessons, and the convenience of learning from my phone whenever i please. thank you thank you thank you. i have only been using it for about a week and i'm already understanding and speaking more espanol. 💛🌵"
duolingo,5,0,it is super easy to use the free version. also to practice to re up your health. the grammar is a bit funny. i am practicing ukrainian. i have a friend who first language is ukraine. he says it is good. so far it is a good pp. i will update my rating after further use. i am rate 21 in banking so far. :)
duolingo,5,0,"i've been hooked on this for a few days now. i've lived in china for a few years, mingled in japanese in college, and had a couple of awesome russian roommates. this pp is great for touching up on languages i haven't spoken in a while and has been teaching me russian at a surprising pace (cyrillic is no joke). sometimes i put in an answer that should be accepted but it's not for some reason; that happens once in ~150 questions or so. not a big deal. oh, and it's 100% free"
duolingo,5,0,"i've download this pp for three times but at each time the sound of this pp become mute ,could you guide me to solve this problem?!"
duolingo,5,0,"intuition, fun, and interesting. top notch, superb - five stars, hands down! ⭐⭐⭐⭐⭐"
duolingo,5,0,"solid start in domingo. started with spanish, to which i did have some previous experience learning. though it never really took back then. it seems to be taking now. not sure yet if that's because of the previous base and the ten thousandth time is the charm for me, or if these short, repetition, simple lessons really help build an understanding. i'm willing to give domingo the credit! overall it's still a more fun method of learning than spanish 1 in school or random learn spanish d's."
duolingo,5,0,"pp is fully free, there are as to support the pp, but it's not intrusion or anything. the pp is also good and very well done. the only ""bad point"" is the lack of explanation, so i would say that if you are really planning to learn, it's a side tool :)"
duolingo,5,2,from my experience domingo is actually a very good way to learn a foreign language. you can use the pp really intuitively and the teaching structure leads to quite fast learning progress. the pp is fun to use and i personally like the separation into different topics and everyday situations. it's overall a nice and interesting way to learn a new language or improve your knowledge about your current foreign languages.
duolingo,5,1,i was first in the league to progress to sapphire and yet it didn progress me and instead i start all over again???? makes me upset keeping hard with the goals yet being thrown off like that. as sad as it is i know how hard the people working there so regardless of that this pp is top notch.. i'm sure it'll get fixed!
duolingo,5,0,greatest way to learn a language. i love the plus version so i am able to go for an hour. it becomes repetition a little but that's what you need! i've had to speak with people who speak spanish to fully understand why a certain word is used or grammar stuff. but overall it's great for learning words and common sentences.
duolingo,5,0,this pp is great! they take it slow and help you when you make a mistake by repeating what you missed up on! love the encouragement that the little owl gives!:) recommend this pp to anyone who wants to start learning a language they're not familiar with! they take you from mild to master with what they teach you:) recommend patience with it too and to not expect yourself to be great at it all at once. take your time:) you can always repeat the lesson!:)
duolingo,5,0,"i've a fair bit of language learning experience, and domingo is very good indeed. firstly, it's not just french/german/spanish/italian courses - many more languages, some quite obscure. i've always laughed at courses with almost-nonsensical sentences (eg, ""the blue mouse is in the trap""), but such tests make you think about *every* word, and not just guess by context. i do some every day, and am nearly 8 months in the hungarian course, and i'm loving it. thanks, domingo owl, you're the best."
duolingo,5,0,i absolutely love the stories. good listening practice and very funny. poor sector
duolingo,5,0,"hands down the best way to learn a language that i have found. it's easy, well rounded, and it works. they have some great option of languages to learn, but also hoping they continue to add as i want to learn bulgaria. still, i could not have made the jump to learn norwegian, german, irish, and garlic without them! highly recommend. if you're on the fence and want to learn a language, look no further."
duolingo,5,1,"fun to play with. excellent content. i'm using it to consolidate my french, refresh my japanese and learn arab (almost) from scratch. sometimes repetition, perhaps, but going through the same (or similar) drill several times helps you develop automatisms and improves your spelling. read out loud as much as you can. very happy with it!"
duolingo,5,0,"i only got this a few days ago but so far it's been engaging, encouraging and overall pleasantly education. the lessons are simple and friendly even for absolute beginners for any language it offers. the daily reminders, subtle spirit of competition evoked from the leaderbaord and the goals and checkpoints all do a great job of helping me learn."
duolingo,5,0,very useful and fun. the word watching one with pictures could be a lot better without the pictures. i try hard to ignore the pictures so i can translate it without cheating but it is very hard since the pictures are so big.
duolingo,5,0,"i really love the variety of ways this pp reaches you a particular language. it's also those same ways that help them stick into your head!!! i would totally recommend this pp to everyone who is trying to get a head start in a language they are taking in class, or even just for the sake of learning a new language."
duolingo,5,0,loved it.. easy to learn and systematic approach to build fundamentals.
duolingo,5,1,"more into on the update, please! i learned 3 languages, thank you! i like how language learning is structures. if you remember some grammar from your own language, you can easily recognize it and also differences between languages that will speed up your learning. i miss a few features from almost 3 years ago, that made domingo friendliest."
duolingo,5,0,"amazing! i love it. the pp is great, and it thought me lots of organ! thanks."
duolingo,5,0,"fantastic pp, it has helped me expand and improve my foreign language skill so much!"
duolingo,5,0,enjoying this pp very much.the l questions are short and precise and if you make a mistake you get another try.
duolingo,5,0,"love this pp, so easy to start learning another language."
duolingo,5,0,"excellent pp,we can use anywhere daytime ,and learn the language."
duolingo,5,1,"outstanding. from basis to advanced, learn at whatever speed and intensity you like. comprehensive. great variety of methods and help. structures and bite-sized: reading, writing, watching and speaking lessons with hints & tips, how and why grammar pages, grade story reading, learner discussions, rewards and so much more. regular updated. plus feedback to responsive, innovative and knowledgeable language and technical developer. not so intrusion as. and free. what's not to like?"
duolingo,5,0,i have tried revising my french for many years now and i can confidently say that this is the best method l have come across. buds.
duolingo,5,0,"this is fantastic. starting from almost no knowledge, i am progressing well learning garlic with lessons lasting a few minutes each day; and it's fun. highly recommend"
duolingo,5,0,i love this pp! i'm reviewing my spanish i learned a long time ago! it's very helpful. i wish you would add tagalog (filipino) since i'm living in the philippines and would greatly appreciate it. i have to use long to learn tagalog. i'd love to be able to learn it in this pp since this pp is better and more fun to use! please add tagalog! i love the new stories! please add the filipino language also! 😊
duolingo,5,0,"been using free version for couple weeks. i have started with french as i once had 7 years instruction, though the last year for this was 38 years ago and i did not keep up usage of the language so have lost most of it; though apparently not as much as i thought as i'm doing very well. the reminders for lesson times are appreciated and not unobtrusive. i hope this can get me to conversational level sooner than book study."
duolingo,5,0,"the garlic course is very enjoyable. the structure is effective - challenging as well as motivation - and i'm surprised how much i'm retaining, in the short term at least. i didn't start as an absolute beginner, but the pp is consolidating the little garlic i had, and extending it considerably. definitely worth spending time on."
duolingo,5,0,"the internet has its good and bad, and at the very top of the best on offer are gems like domingo. i have been learning languages on and off efficiently for years, and domingo has taken me next level. simple, interactive and designed beautifully. thank you. i'd give 6 stars if possible. love your work."
duolingo,5,5,"pretty good for practicing a language you've already had a bit of experience in, but i don't think it's the best for learning languages that don't use standard letters found in english, french, etc., like japanese or organ. it simply doesn't go into enough details about the basis and just shoves it in your face, making new earners become discouraged from being overwhelmed. i suggest having some other beginner-friendly apes before trying to learn one of those languages on here."
duolingo,5,0,i do not know all language learning apes but from the ones that i know this is by far the best pp. i usually hate apes with as but i do understand their importance for you from a business perspective and their necessity. i hope it will always remain free. thank you for this amazing pp. amazing job worth 10 stars
duolingo,5,0,this pp is the best i do not have any problem with it the pp is free the as are not outrageous and i do recommend for everyone
duolingo,5,0,"domingo is a great, easy-to-use pp for language learning that makes it fun and engaging to do something that was very tedious in school. i'd be happy if apes like this replaced school altogether. it is very well-programme, it makes sure to continually motivate you, and rewards all types of learning style."
duolingo,5,0,love it! easy fun accessible way to learn a new language
duolingo,5,0,an amazing language learning aid! the improved competitive leagues really drive me to practice more with each session. this pp has really assisted me with my organ studies and it is completely free! someday soon i will join the paid version as it adds that final touch to really sharpen my skill.
duolingo,5,0,"from what i've used so far its excellent, repetition so that you can memories the words well. it takes time to learn and remember the language so i've learnt that you need to be patient with the pp as you won't learn it in 2 weeks but it could be months the more you use it."
duolingo,5,0,the best way to start learning a language i've ever tried (not there have been many) fun to pick up and easy to get started!
duolingo,5,0,"one of the best ways to learn a new language, give been using it for a few days and have already learned so much. mi gust!"
