app,ratings,helpful-vote,comment
duolingo,5,0,"it's a really good pp. i really wanted to learn organ because i'm super k-pop obsessed, and i've found that the knowledge really sticks to me, unlike all the other ones i've tried."
duolingo,5,0,very easy to learn with. love the games. makes it easier to remember and takes little to no time to start firing out your new language.
duolingo,5,0,"so far, it's been a fun and awesome adventure learning new languages. i'm on my third week and i really can't remember another game i've ever played that is entertaining yet also reaches valuable information. i'm signing up for domingo plus this week cause i believe in the software and it's helped me a great deal. so i can help do!"
duolingo,5,0,a very good learning pp. sometimes has a small pitch but overall works well. have learnt more on this than i can remember doing at school over 40 years ago!!
duolingo,5,0,"the truly is so fun and so easy. i've only been using it for a week or so, and i'm shocked how fast i'm learning. i love it and have recommended it to multiple people. great pp!"
duolingo,5,0,this is a really great pp! i like that grammar notes are starting to be added to the pp—they were only online when i first used domingo years ago. i just wish russian had grammar notes in the pp now!
duolingo,5,0,fun and simple way to spend 10 minutes a day learning a new language. there is also a community inside the pp that talks about the questions and answers in depth. very cool!
duolingo,5,0,"all i can say is, great! would like them to go one level more basic with the alphabet, but otherwise i will only recommend."
duolingo,5,0,love this pp. there a huge range of languages and i can work at my own pace and even not do listening challenges if i am in a location i can have the volume up.
duolingo,5,0,takes just a few minutes a day and is super easy. i can press the out loud button to hear the pronunciation as many times as i want! too fun!
duolingo,5,0,easy and fun to use pp for learning new languages. the badges and leadership board are some nice features which make you use the pp on a daily basis.
duolingo,5,0,"learning a language is simple and quick on domingo. the lessons are very well made and scale well with how you progress. i would recommend you get lesson to gold before progressing to the next level, and if you can buy the domingo plus."
duolingo,5,0,"fantastic pp for learning a new language, i have only been learning french for a week now & i have learnt so so much. the encouragement & information in the pp is extremely beneficial. the best pp i have tried so far & the fact that it's free is amazing. can not recommend this enough"
duolingo,5,0,"i've been learning a whole lot because of this domingo. i love it so much. plus, it doesn't hurt that it's free. the as aren't irritating at all, because they help maintain this amazing pp."
duolingo,5,0,"outstanding service. tons of languages that are community-driven, taught in an engaging way. all of it free, with non-disruption as and minor paid content."
duolingo,5,0,"i love the new stories! i've mastered the course once or twice, and was getting bored, but not anymore!"
duolingo,5,0,it is one of the best language learning apes you could get. it's completely free to learn new languages but there is a choice to buy premium which looks pretty good. i would recommend this pp.
duolingo,5,0,"it is really a great pp, except when a word needs an accent above it. my phone doesn do those, and the pp keeps reprimanding me about it."
duolingo,5,0,"as a multi language, i consider domingo one of the most useful free pp. i have learned a lot of languages: russian, french, german, spanish, portuguese, danish, swedish, dutch, and also latin. it provides you with a daily and weekly score and a language banking parade with other users, so it can takes you time. so, i suggest to follow your own schedule for not being addicted. i love the new diploe section as well. some language to improve about the pronunciation, but it's worth to have."
duolingo,5,0,"fantastic pp! i really enjoy progressing every day! it just takes 15 minute/day commitment, and in 1-2 years you can learn a new language."
duolingo,5,0,it has helped me lastly improve my spanish. the pp developer have made huge strides in fixing bags and clashes while also improving the pp overall.
duolingo,5,0,"the audit files don't play in my phone for some reason, i'm not sure if it's a bug of some sort or if the internet speed is not fast enough."
duolingo,5,0,i love domingo. this is such a well set up pp and learning a new language is so easy and fun.
duolingo,5,0,"great language learning pp! took a break from it for awhile and on returning, good to see extra stuff on the french course. introduction of scottish garlic is brilliant! thank you."
duolingo,5,0,absolutely love it. easy to follow and learn at our own pace. as far as as are concerned we can pay for the course so we don't see the as. it's a choice
duolingo,5,0,"a brilliant and fun way to learn gàidhlig! a lot easier than all of the audit books, books and webster i've tried to use in the past."
duolingo,5,0,"it's great the exercises are repeated from the initial one in each lesson, enabling the learner's rural and written abilities. the only single i have is the lack of grammar guidance, which makes learning when to state words in welsh impossible if using this pp only."
duolingo,5,0,this pp is easy to use and effective it covers everything reading writing pronouncing and hearing okay. and it has many languages only wish that it had a little bit more languages.
duolingo,5,0,"well i have now found doing it on my lawton, all the other bits and pieces have appeared. am able to download pre starting a lesson very important stuff. still love it."
duolingo,5,0,really great application! keeps you entertained and makes learning a language fun and memorable experience. definitely recommend!
duolingo,5,0,it's an amazing application for learning a new language.
duolingo,5,0,"this pp truly challenges your current knowledge, adds to it, praises your achievements & encourages you when you agent doing well. i love it!"
duolingo,5,0,"i appreciate having an pp i can use to practice a language every day, and i love that i can choose to study more than one language comprehensive, for free! it helps that domingo has a cut moscow to cheer you on as well."
duolingo,5,0,"i like it and i am learning spanish for fun because my big his gave a spanish grammar book so i thought i should download a pp so i looked at editors choice at language learning apes so your pp was in it. and i download it and i have a problem.the pictures which is in the help article for andros. but when i go in my pp,its like is but i have andros phone"
duolingo,5,0,i use it for japanese and it's the best learning pp i came across. i learn so much faster
duolingo,5,0,this premium model amuses me. worthy contents are present. if you have the discipline and determination then u can make any language your friend using domingo.
duolingo,5,0,i am having a lot of fun learning scots garlic and this makes it easy with short but effective lessons.
duolingo,5,0,amazing pp i learned so much and it is easy to understand. there are also so many languages to learn from. love it!!!
duolingo,5,0,simple interface that helps with consistency .
duolingo,5,0,an excellent resource! it's very instructive and fun!
duolingo,5,0,"this is wonderful! wish i could get the verbs figured out! hard to learn a new language at 80, but this is so helpful. love the language."
duolingo,5,0,i have used loads of apes to learn. but this actually showed the true results. thank you so much whosoever designed it. thank you so much.
duolingo,5,0,very easy to follow.. studying the office into is very useful when listening to the language. some things do not make sense unless you have that into and domingo provides it!
duolingo,5,0,"fun while learning, a great game to be addicted to. i'm new to this pp, and so far so good. i just wish i can study the podcasts by listening to them for several times more."
duolingo,5,0,"i love this pp. i am consistently motivate to move forward and study every day. i see the improvement in my ability to hear the language, even outside of the pp."
duolingo,5,0,absolutely amazing i've been using domingo for about 6 months now and it is incredible! this pp has helped so much with my schoolbook and my actual understanding of french and spanish. i would definitely recommend it to my friends.
duolingo,5,0,i am 69 years old and have never attempted to learn a foreign language. this pp is amazing and makes it so easy to learn. others say something to me and my st thought is a response in spanish. i highly recommend this pp for someone to learn a foreign language.
duolingo,5,0,keeps getting better and better. great way to learn for free
duolingo,5,0,"at first stage it is ok, but the rest of the stages becomes more fun. and in only 2 day's, i know how to make a simple sentence in german; ich bin ein case!"
duolingo,5,0,"i really love this pp and it is one of my favorites that give gotten, easy, free, fun. would recommend for anyone learning a language. my only suggestion is a dark theme (unless there already is one)"
duolingo,5,0,i love this! domingo makes it so much more easy to learn a new language even if you are to busy to always stay consistent i highly recommend it. :)
duolingo,5,0,"knowledge is key, and this pp knows that because why would it charge you to know and experience more? knowledge sure ain't free, but this pp is effective in its repetition, and presenting the information to you in different forms"
duolingo,5,0,"very useful application for learning, practicing and improving a bunch of different languages. give it a try and watch out: you may get addicted to it."
duolingo,5,0,"this pp made me realise that it is very easy to learn a new language. as the lessons are arranged in a particular pattern, it makes learning simple."
duolingo,5,0,thanks domingo for correcting the issue and placing me in the correct league. excellent customer service and dealing with issues real quick. onwards and upwards! excellent pp for learning a language overall.
duolingo,5,0,"absolutely fantastic if you know the very basis of a language. so i picked up french very easily however, i found the japanese which completely new. to me incredibly hard to just memories the karagina"
duolingo,5,0,pp is fantastic as if you run out of hearts to get more to try and move ahead you have to do a practice section so improving your skill further. so glad it's free as well.
duolingo,5,0,domingo is an awesome free learning tool for many languages. i am very pleased of the newest update that was recently added. domingo has made learning fun and easy!
duolingo,5,0,really helpful with proper grammar and pronunciation. like the interface and communication.
duolingo,5,0,"an amazing pp! you do not have to pay, it doesn't take a lot of space and at the same time, you learn and improve your languages! really helped me with my studying!"
duolingo,5,0,good application for training vocabulary. speaking training is also good but ai still having issue that can not recognize some sentences having almost same meaning.
duolingo,5,0,"they make it so simple to learn. somehow it's easy to memories the content, and i find learning here somewhat adjective!"
duolingo,5,0,"this pp is great! i'm about 37 days into learning welsh and i'm not going to lie, though very difficult, i'm becoming the bomb! thanks!"
duolingo,5,0,love it. easy to use. easy lo learn.
duolingo,5,0,really fun but it lacks some reading material
duolingo,5,0,very helpful!! it's fun and i'm making progress!
duolingo,5,0,"great pp, i've learnt a lot. the new update is really good with the stories but the old lessons are cracking too frequently and i am not making as much progress because of it"
duolingo,5,0,i love this pp! it helps me a lot. i'm only 9 years old and i can understand german ( the language i'm learning ) even more than i did before because all i could do was counting up to 10 and say hello ! thanks soon much i really appreciate it do!!👍👍👌
duolingo,5,0,the best pp for learning languages! even has things like clinton for those star tree fan!
duolingo,5,0,"short little chinks of learning, which is great. i've retained pretty much everything i've learned without much effort. great for a free pp."
duolingo,5,0,"really neat pp, makes learning another language feel easy and fun"
duolingo,5,0,can not rate this pp highly enough. even their as are easy to watch
duolingo,5,0,so easy to use and you find yourself learning without really thinking about it
duolingo,5,0,"enjoying it a lot, never thought i'd be able to pick up even a ll bit of another language without taking a proper class. hata."
duolingo,5,0,it's fun and you can learn clot. but the free version is confusing for total novices. it works for me since i already know quite a bit of the language.
duolingo,5,0,i can't believe this pp is free!! i am actually learning to converse in french!! i do wish though they would spend more time on the verbs and propositions. overall a great pp!
duolingo,5,0,"really useful pp. got it first for my daughters gase spanish, am learning more irish. fun, easy to use, reinforced by repetition, great that it has spoken language, only used written before. thanks!"
duolingo,5,0,"domingo is great for kiss and adults learning about different languages.they have so many categories such as into,family,and food.i am learning enspanol ak spanish.domingo makes it easy for me and much others to learn.i think they make it better than any other language learning apes.they let you learn more than 1 language at a time.i think i will start to learn french as well as spanish.i highly recommend downloading domingo if you are interested in learning other languages!5/5."
duolingo,5,0,"great pp to start learn new language. sometimes recording is not working as expected, it stuck processing what i said."
duolingo,5,0,"i really love this pp since it is free and i am learning spanish. this is a great pp, although the hearts run out quickly and i think they take too long to refill :)"
duolingo,5,0,"great pp, haven't seen any stitches or had any problems. i've been working on japanese kann. haven't tried any other languages yet"
duolingo,5,0,"fun pp for learning languages. highly recommended. the pro version will allow you to learn office, such as on planes and does not contain any as."
duolingo,5,1,i think domingo might be the best way to learn another language because it is extremely user friendly and it goes over similar things many many times to ensure you understand the topic/subject.
duolingo,5,0,"easy to use and lessons are challenging without being overwhelming. lots of repetition, but with variety so it's not boring."
duolingo,5,0,it is a very handy pp that helped me a lot with that daily practice and lots of helpful comments made by the other users. you can really learn a foreign language! love it!
duolingo,5,0,really amazing pp i use it as much as i can and the free pp isn't bad it just has as that are easy to dismiss and they don't interrupt the lesson!! 100% recommend
duolingo,5,0,i generally love this pp. i just wish it was more descriptive for different languages and organized a little more. adding arabic would be pretty awesome too!
duolingo,5,0,all the repetition makes learning a new set of characters so much easier! less than 2 weeks in and i already feel so confident with what i've learned!
duolingo,5,0,"it's more practice than theory,so it's not for everybody. but for the majority of us domingo is a quick practical way to learn or refresh languages ."
duolingo,5,0,this pp is hell fun man. got into japanese and i really feel like i'm making rapid progress. plus the as are really not invasion.
duolingo,5,0,this pp is great. so many languages to chose and covers a lot of topics. also there is no cost involved in using both this pp and it's webster.
duolingo,5,0,"fun experience. learning a little bit every day, memorising different phrases, earning rewards and competing with friends - learning a new language has never been so fun and enjoyable."
duolingo,5,0,excellent tool to learn another language. love it
duolingo,5,0,"the repetition is exhaustive but worth it, i am really learning, not just superficially learning."
duolingo,5,0,fun. encouraging. easy to pick up where i left off.
duolingo,5,0,"i love how it is on your time. you can use this daytime that you would play one of those silly games you spend so much time putting around with. it's actually fun too! winning!! new skill, minimal effort? yes please!!! ll."
duolingo,5,0,best pp i've come across. helps me pronounce words properly as well as learn new content in a thorough and easy manner. enjoyable and information.
duolingo,5,0,"great for picking up the feel of a new language! one grip would be that it uses the same vocal again and again, i'd prefer to learn some new words!"
duolingo,5,0,"i love this, it's better than learning in school. i am currently learning french and i am starting italian ad well. i definitely recommend this, you go at your pace.."
duolingo,5,0,"an absolutely superb tool for learning a new language, or touching-up on a language you haven't spoken in awhile. highly recommended."
duolingo,5,0,"create teaching tool, it allows you to revise what you have learnt, and introduces a new word among familiar words. these technique helps retention. i have tried many other similar apes and domingo is the best so far."
duolingo,5,0,it's a wonderful pp because it provides practice in a fun way and at the same time it makes sure you memories the rule.
duolingo,5,0,it is insanely helpful and not at all invasion with as or pushing the plus membership. it's very useful and great for learning.
duolingo,5,0,"works as intended. has as to support free education, but it's definitely worth it to be able to work on picking up another language for free."
duolingo,5,0,not demanding on a busy schedule. easy to use. love it!
duolingo,5,0,this pp is very good to me practice daily. thanks ad team.
duolingo,5,0,best learning game ever. it makes it so much easier to learn than attending a class
duolingo,5,0,"easy to use, motivation and encouraging. as aren't too invasion on the free version."
duolingo,5,0,fun and very easy to get started getting great results
duolingo,5,0,it is really a fun way of learning a language. through a repetition of a vocabulary and grammar it actually does stick in my head!
duolingo,5,0,"very easy learning curve. always makes you feel like you understand what is being taught, even if you didn't get a perfect score on the lesson."
duolingo,5,0,excellent pp. i'm currently mastering french. its easier than i thought
duolingo,5,0,"amazing pp where you can learn a language for free and also help free education. i started learning spanish 3 days ago, the lessons are fun and to my level. a brilliant idea 💡 thank you domingo 👍💯"
duolingo,5,0,great pp for learning languages quickly.
duolingo,5,0,do is the best pp for language lovers... thank you so much. there is no any problem here.😃
duolingo,5,4,"easy and fun learning for everyone. very pleased, unique application"
duolingo,5,0,great pp if you want to start to learn a new language
duolingo,5,0,"it's a very helpful pp for people, especially beginners, who are learning or who want to learn other languages."
duolingo,5,0,very easy and fun. 5 minutes a day has been great to fit in learning a new language. i love that it let's you hear the words and speak the words.
duolingo,5,0,"it's truly amazing how in a week, the pp got me interested in learning the basis and indulging me with exercises to help me grew my interest for a new language, hands down the best pp to use if the intent is to learn a new lingo."
duolingo,5,0,"pretty fun to do, actually! keeps you involved in the language you're learning without being completely overbearing. will continue using the pp."
duolingo,5,0,"i just adore domingo. a great way to support immersion language learning- and free!! i'm finally able to properly learn some gàidhlig after years of not being able to afford normal classes, and without many online resources."
duolingo,5,0,a friend recommended this pp and i love it! it's nice to be more familiar with the spanish language since i hear it all the time. this pp helps me broaden my vocabulary in a fun way.
duolingo,5,0,"if you take a foreign language class and you don't understand some of it or you're not learning anything, do lingo is the way to go! it's very helpful, you learn a lot and the lessons are very simple!♥️"
duolingo,5,0,very inspiring...motivation and strong fundamental skill...excellent and very enjoyable..thank you for a brilliant pp!!!
duolingo,5,0,simple n convenient n try to make a global chat option to learn more easily
duolingo,5,0,it has been a terrific learning experience. learning something new can be frustration but domingo has enough repetition to make things click.
duolingo,5,0,"i installed it to learn spanish and so far i absolutely love it. of cause there's ad, but it you want to learn language for free it worth it. i'd definitely recommend this pp"
duolingo,5,0,it's really good...helps you learn in a very systematic manner...helps not only with sentences and words but with pronunciation as well... i'd definitely recommend ｡◕‿◕｡
duolingo,5,0,probably the best pp to learn a language at basic or even above for free
duolingo,5,0,"i have really enjoyed using the pp... learning on it is fearless and i can't stop enjoying the story mode, the humour in it is genius. i'm glued!!!"
duolingo,5,0,"i love this pp, i paid the 6 month fee to stop the avert but it was worth every penny, in 1 month i have learned so much german and i've started doing garlic also, cannot recommend highly enough!"
duolingo,5,0,"great pp! free version has non annoying as, and i've already learned way more than i did in he spanish. actually considering buying it just to support the cause."
duolingo,5,0,amazing quality pp! learn almost any language for fun!
duolingo,5,0,it has s step by small step approach to learning a language.
duolingo,5,0,"super easy and fun to use, already recommended to family and friends to use it and has been super easy to understand and learn as new language!"
duolingo,5,0,best language learning pp ever. i love the short stories too.
duolingo,5,0,"this is truly an awesome pp. it can improve your knowledge fast because it contains more challenges,levels. learning with domingo makes me happy and also more knowledgeable."
duolingo,5,0,super awesome and really easy going. challenging as you level but really helps you learn the language. love that it also reaches you the written language for it as well
duolingo,5,0,"while i don't feel this is the beat way to learn a language from scratch, this is a fantastic resource for continuous learning and reinforcement. it is a wonderful pp."
duolingo,5,0,"keep glowing 👍 one thing to add you guns! add more details to users profile, please and it seems to be a a problem when i try to change my email address using the phone :( its professional when it comes to this"
duolingo,5,0,"domingo has been super helpful to learn languages! i love it😄 if you are not an english speaker, you can adjust the pp settings so that the pp is another language, and they have lots of languages!"
duolingo,5,0,excellent pp! i've learned so much from this pp than i could in school. it's managed to keep my focus with the stories and challenges they have.
duolingo,5,0,awesome pp if you want to learn different languages. more fun than reading a lame book. it is competitive too so it makes you want to learn more.
duolingo,5,0,very easy to use and with a lot of exercises. the phrases don't make sense sometimes but it's an excellent to learn grammar on the go.
duolingo,5,0,"this pp is adjective, fun, and as far as i can tell accurate. there are even competitive components to keep you coming back!"
duolingo,5,0,"i've learned so much, in such a short period of time! it really works, and i couldn't be more impressed! i've begun to actually understand japanese, a language completely foreign to me, way faster than i began to learn spanish in 4 years of high school!"
duolingo,5,0,"very easy to use, and entertaining. as are closable after just a moment. provides positive feedback when doing well, highly motivation."
duolingo,5,0,my sense of understanding is increased in this format. the voice feature in not sure of. as i build blocks of conversation i will see if it registers true.
duolingo,5,0,"it is a great pp that makes learning easy. something like this usually cost quite a bit of money. not only is it free, but you can do the lessons anywhere when you want to. i love it!"
duolingo,5,1,"great pp for learning languages! the only thing that could be improved is adding the language grammar tips to the mobile version of domingo, because only the webster version has them"
duolingo,5,0,"is pretty good ! it reaches me 11 word at one day but can you add more languages like tagalog , chinese i mean i know how to speak chinese but let the other know how to learn too! as i was saying , add more . keep it up ! :)"
duolingo,5,0,i am always use it . it really reaches you a lot. best pp ever! it helps you learn more and encourages you by using parts and streaks . i love it!
duolingo,5,0,fun way to work on learning a language. you get points for going back to old lessons which is great for really learning a language well.
duolingo,5,0,makes it fun and competitive to learn new languages without causing a drag so far. not necessary to get pro to get the full enjoyment of the pp. could be nice with an up boost the bigger your streak is
