app,ratings,helpful-vote,sentence
duolingo,4,0,the only issue i have with this pp is that you have hearts and if you lose your hearts you can't learn for a little.
duolingo,4,0,people came to this pp to learn and you guns are taking that away just because we miss 5 questions.
duolingo,4,0,in all it is a good pp but that's the only issue.
duolingo,4,0,"good pp, makes learning fun to do and feels like a more natural way to develop linguistic skill."
duolingo,4,0,"only complaint is that the speaking part never works for me, not sure why microphone works with other apes."
duolingo,4,0,also i'm not keen on the apples.
duolingo,4,0,it feels like you are too heavily penalized for making mistakes.
duolingo,4,4,pretty great pp if you want to learn a new language.
duolingo,4,4,looking at the comments on a question can help you a lot to understand how the language works as well.
duolingo,4,4,one thing i would like to see for this to be a 5* rating would be to add the notes for lessons that the pp version can access.
duolingo,4,4,"while learning organ, i got super lost when it just threw particles into the mix of things, and ended up having to go onto my pp to check the notes on how they work, which isn't very convenient."
duolingo,4,0,"unlike previous language-learning experiences, i find domingo highly adjective."
duolingo,4,0,which hopefully will make a difference.
duolingo,4,0,time will tell.
duolingo,4,0,"only on stage 2, 3 days use."
duolingo,4,0,i really like this pp.
duolingo,4,0,it is very helpful and easy to understand.
duolingo,4,0,it makes learning english simple and funny.
duolingo,4,0,it's a excellent pp for those people who don't know how to speak in english.
duolingo,4,0,this pp teach us english through hind.
duolingo,4,0,there are graphics too good.😍
duolingo,4,0,"great pp, my only grip is the hearts system as it really interests the learning flow, but i understand why they have it."
duolingo,4,0,good for new earners and beginners but few exercises are repetition and that makes learning boring sometimes........more regional languages need to be added.
duolingo,4,0,great learning pp for angel but not for pronunciation.
duolingo,4,0,they need to improve the audit.
duolingo,4,0,other apes are better for this.
duolingo,4,0,"i like the pp, it's just why do you only get a certain amount of hearts."
duolingo,4,0,if you lose< how come you have to quit and lose all your progress.
duolingo,4,0,that needs to be fixed.
duolingo,4,0,great pp i feel like i'm learning more here than in spanish class.
duolingo,4,0,my only complaints are i think the hearts should be unlimited.
duolingo,4,0,i like learning spanish and i can't do that if it's limiting me on how many mistakes i'm allowed to make.
duolingo,4,0,and when i do the speaking test i'm positive i'm saying it right and it doesn't process right sometimes and i loose a heart.
duolingo,4,0,"great way to learn, fun and quick to make progress without realising it."
duolingo,4,6,"it's great for learning the basis of a language, but as you get better and clock more tense, it becomes a follette."
duolingo,4,6,"the single sentences don't give you enough context to know if you should use indicative preterite, indicative preterite imperfectly or any other past tense."
duolingo,4,6,"this is not consistent in the pp, and it drives me mad."
duolingo,4,6,"the same goes for many adjective, like the difference of being kind, good, nice and so on."
duolingo,4,6,you really shouldn't be punished for mixing those up.
duolingo,4,0,"very good learning pp, made me start to learn russian and now i can talk to russian players in is:go."
duolingo,4,0,"sadly, i can't sign in."
duolingo,4,0,it just stands there after clinking the sign in button.
duolingo,4,14,this pp is really great for learning a new language.
duolingo,4,14,i feel like i have made good progress after just a third of a year.
duolingo,4,14,"but there are updated that make me feel as though my learning is not as in depth as it was in the beginning, for example every category level only has four sets of questions before leveling up whereas in three beginning there were sets of up to 20 questions."
duolingo,4,14,i would give the pp 5 stars if only some of the recent changes had not been made..
duolingo,4,41,i love this pp.
duolingo,4,41,i gave it four stars because it incorporated competition and i don't necessarily want that in a learning pp.
duolingo,4,41,it puts more pressure on me to not lose my arbitrary place in the ranks.
duolingo,4,41,i have enough to deal with in real life.
duolingo,4,41,even the idea of worrying about losing my streak or place on a leader board is unwanted stress.
duolingo,4,41,"otherwise, absolutely perfect a. i'm learning so much so quickly!"
duolingo,4,3,i really like the pp and gives an around education for language.
duolingo,4,3,i only wish the subscription fee was lower.
duolingo,4,3,"for a 12 month subscription you're still paying 7.69, only 30 cents less a month than the 6 months plan, to me it's just to much even though i want to support the pp, i'm just a student so my income isn steady enough for that"
duolingo,4,0,"after initial slight disappointment, i'm beginning to learn the value of this pp."
duolingo,4,0,"it goes a little slowly for me, but there again, i could always spend more time on it than i currently do and it probably gets more difficult as time goes on."
duolingo,4,0,not bad at all.
duolingo,4,0,i might go to 5* once i've got more experience at a more advanced level.
duolingo,4,0,"i like the pp, i like the languages it promotes and the learning program and everything."
duolingo,4,0,"but what i don't like is that i have to wait like 5 hours for 1 heart, so you can't really make mistakes when that's part of learning a new language."
duolingo,4,0,"so, that's the only part i don't like."
duolingo,4,0,i think we should get more hearts like 5 hearts in an hour.
duolingo,4,0,i like the pp.
duolingo,4,0,"a bit repetition, but makes sense from a language learning perspective."
duolingo,4,0,"currently new user this language pp, which seems alright."
duolingo,4,0,"mostly words clear by voice, but sometimes voice seems low."
duolingo,4,0,good language translated
duolingo,4,0,it's easy to learn but would like to have more hearts for when new words are introduced and missed to continue learning.
duolingo,4,0,i only started using the pp a few days ago and it has helped me learn new french words and also helped improved my pronunciation.
duolingo,4,0,it is fun and makes learning easy!
duolingo,4,0,i do have a small problem though.
duolingo,4,0,"when it tells me to speak, i don't know what part i said wrong so i can't fix it."
duolingo,4,0,please help me.
duolingo,4,0,pretty good but hard to progress at times.
duolingo,4,0,has me looking to other apes sites and video just to make sense of it
duolingo,4,5,"i use this pp to help me learn japanese, so i can't comment on other languages."
duolingo,4,5,"but it's overall a fantastic learning tool, though isn't the best for adequately learning the language."
duolingo,4,5,the only thing that keeps it 4 star is that there is a lack of grammar explanation and the insistence to use anti.
duolingo,4,5,"there should be little to no anti early on, as it makes it so much harder to learn new words since the anti characters are insanely complicated"
duolingo,4,0,really great.
duolingo,4,0,just not 5 stars as there is not an option to change american english for british english as user's native language
duolingo,4,0,"i started using domingo on my phone, did some good progress in arabic."
duolingo,4,0,now i download it on my tablet and can find arabic in my course!!
duolingo,4,0,please fix the problem.
duolingo,4,0,thanks.
duolingo,4,0,one of my all-time favorite apes.
duolingo,4,0,for those whom education is unfordable or inaccessible this is a great pp to help learn language.
duolingo,4,0,it's best for adults but great for kiss in that it helps them also read in their first language.
duolingo,4,0,this pp could be improved if it had the ability to have multiple users in one account... eg: in perhaps a similar format to the way netflix has for multiple users on one a/c.
duolingo,4,0,i'd be willing to pay more to remove as for a family/group /school account.
duolingo,4,17,"this has been a great pp for a while now, it has really helped me with learning hungarian."
duolingo,4,17,but the new update has dulled the experience.
duolingo,4,17,"before there were more lessons per level, repeating phrases over and over, often getting them wrong, but learning from the mistakes made and progressing."
duolingo,4,17,"now, it has been simplifies, less lessons per level with less repetition, with an up driven promotion system to beat others on a leaderboard."
duolingo,4,17,apparently learning a language is now a competition.
duolingo,4,0,great pp and fun to use.
duolingo,4,0,only lost a star as i think it would be helpful to have a section on phrases you will need on travelling to italy earlier on which i personally would have found reassuring.
duolingo,4,0,"all the lessons are beneficial though, especially for a free pp & i can certainly recommend it."
duolingo,4,0,"this game is some, i got to choose what language i wanted i got to skin but with a test .but i have a down side the test said that less than 4 wrong answers then you pass but i got 2 and i failed soooooo you have to fix that mister/missis bye people!"
duolingo,4,0,"good with basis, but you would have thought the as pay for the lessons, bit you have to get these heart things which discourages you from learning."
duolingo,4,0,it's very helpful and easy to use..loved this pp!!
duolingo,4,0,but i'd like to add that while learning organ i saw that it doesn't reaches about bowels and consonants first but jumps into characters..so that was a bit hard to learn as i didn't know..but the pp is great for learning new languages!
duolingo,4,0,and i love the podcasts too!
duolingo,4,18,i like it clot but if i had not previously doubled in the language i would be totally lost.
duolingo,4,18,i wish they had something that explains the tense of words it really would be helpful.
duolingo,4,18,"i also hate that when your out of hearts you have to wait a certain amount of time before you can play again, unless you accumulate them through practice runs."
duolingo,4,18,like i said if i had not doubled in the language in my younger years i would have thrown my phone across the room and quit.
duolingo,4,0,really enjoying and getting a lot out of domingo.
duolingo,4,0,i speak three languages and learning a fourth.
duolingo,4,0,"although there is usually plenty of information floating around the web, it would be nice if there were relevant references and complimentary material built-in or linked to from the pp."
duolingo,4,0,"other than that, nice job guns :)"
duolingo,4,5,"great tool, easy to stick with."
duolingo,4,5,a bit silly (owl) but that's fine.
duolingo,4,5,my one complaint is the default speech speed setting.
duolingo,4,5,it's absurdly slow with no user ability to set default to normal.
duolingo,4,5,yes you can easily reply the dialogue at normal speed but the action interrupt the flow.
duolingo,4,5,fix that one flaw and in my opinion it would be a near perfect pp.
duolingo,4,0,great to use every day but hard to change the language.
duolingo,4,0,otherwise great idea.
duolingo,4,6,up??
duolingo,4,6,ink if it's a problem with my phone or the new update like it used to work fine but i don't hear anything anymore?
duolingo,4,6,"like when i'm doing japanese and it's supposed to say the sound a letter makes it just like, doesn't??"
duolingo,4,6,?
duolingo,4,6,"kind ruins the whole experience for me since you know, i don't know what sound the letter makes, and how am i even supposed to ""type what i hear"" when i don't hear anything,, but i don't want to give a bad review since it might just be my phone, don't see how the."
duolingo,4,0,"everything is great and as a training it is 👌, but i would avoid it if you start from ground zero."
duolingo,4,1,mostly good.
duolingo,4,1,i'm no expert at language learning but i think this is quite effective at it.
duolingo,4,1,"one thing i wish they'd change is the inclusion of a dictionary, or some kind of word list."
duolingo,4,1,"if i've forgotten a word and want to look out up, i'll have to red the lesson and just hope it comes up again."
duolingo,4,0,it's a great pp but sometimes the hints don't exactly help you with questions.
duolingo,4,0,plus some languages don't have the tips section.
duolingo,4,0,they are only features on the computer version.
duolingo,4,0,it should be available to all.
duolingo,4,0,i'm learning russian and there is no tips page so i have to assume what the ending of the noun is.
duolingo,4,0,hopefully domingo will change this.
duolingo,4,1,excellent and getting better.
duolingo,4,1,a bit harder for beginners with no knowledge.
duolingo,4,1,"would like to see more done, such a new fun and situation activities."
duolingo,4,1,the new reading one is excellent!
duolingo,4,1,there's also not much content regarding what you can spend your lights on.
duolingo,4,1,"idioms, flirting phrases and 3 outfits is it so far."
duolingo,4,1,"would love a range of outfits to motivate me to earn more lights, or a house!"
duolingo,4,1,would also love that to be available.
duolingo,4,1,great for not letting my a level knowledge get rusty after years :).
duolingo,4,0,too many as and disruption in the free version.
duolingo,4,0,therefore difficult to truly evaluate.
duolingo,4,0,"i have an opinion as a andros developer, it could be great if we had a section that saves words we learned as flash cards for practicing later"
duolingo,4,0,great and free.
duolingo,4,0,unfortunately doesn work well put of good wife bones - clashes and fails to work on g
duolingo,4,12,"amazing, well designed, well meaning, motivation, and useful."
duolingo,4,12,i can already see some impressive results!
duolingo,4,12,"i'd give it five stars if the interface regarding the friends could be a little more intuition, i've had trouble finding friends and i can only see who i'm following, not who's following me."
duolingo,4,12,"other than that, incredible work!"
duolingo,4,0,it's a lot of fun and i would recommend it to anyone who is totally new to a language.
duolingo,4,0,sadly enough you can't start at a higher level
duolingo,4,3,the pp has been good.
duolingo,4,3,i hold off on saying great more for personal reasons.
duolingo,4,3,"at this time, i am using the free mode."
duolingo,4,3,"i'm on a 13 day streak of using it daily, and i'm currently trying to learn spanish & french."
duolingo,4,3,it's great having access to a language learning resource in my pocket (telephone).
duolingo,4,3,i wish i would've had something like this back in high school.
duolingo,4,3,i am enjoying being exposed to words/concepts daily.
duolingo,4,3,i'd love to learn more and look forward to what's to come.
duolingo,4,4,i download domingo to learn arabic.
duolingo,4,4,"it's a powerful learning tool for sure, and the interface is intuition and well thought out."
duolingo,4,4,"however, for learning arabic, i would tread with caution, as the lessons have a bad habit of mixing modern standard arabic with dialect arabic, which should never be done."
duolingo,4,4,"because of this, i've stopped using the pp and moved on to a study guaranteed to reach only ma."
duolingo,4,4,"for other languages, this pp is a no brazier."
duolingo,4,1,"overall, very good."
duolingo,4,1,"however, i would like to see an additional possible answer for the sentence translations, and maybe also a feature for you to fill in missing phrases on a hypothetical conversation between two or three people."
duolingo,4,1,a nice dark mode would also be appreciated.
duolingo,4,0,it's a good pp for languages but the mobile version has hearts unless you buy the premium version other than that it really good.
duolingo,4,0,looks great but it didn't have that.
duolingo,4,0,i find that too be very strange when there are so many lesser spoken languages
duolingo,4,15,"if i was rating only the learning experience, 5 stars."
duolingo,4,15,the lessons are fun and effective.
duolingo,4,15,"i'm learning so much, and enjoying the process."
duolingo,4,15,the pp itself is 4 stars.
duolingo,4,15,"it frequently freeze, and random doesn't record my progress."
duolingo,4,15,there also seems to be issues singing between the webster and the pp.
duolingo,4,15,"i would like to see the stories on the pp, not just the site."
duolingo,4,15,and it would be nice to be able to collapse the lessons once you pass a checkpoint.
duolingo,4,15,all that strolling is tedious.
duolingo,4,15,:) and a vocal review.
duolingo,4,0,it's a great pp to lean the basis of any language you're interested in.
duolingo,4,0,the only thing that i would like to see in the future is a vocabulary list or some other way to see all the words you have learned so far without doing all the courses.
duolingo,4,0,it would be great if that could be added in the next update.
duolingo,4,149,very good pp for basic learning.
duolingo,4,149,"the only downside is that it does not explain rules or basis, so the approach is really intuition (a guessing game sometimes, and left to your interpretation of the rules as you go along in learning translations)."
duolingo,4,149,"the approach to learning is fun and easy, though."
duolingo,4,149,no boring lessons.
duolingo,4,149,would be good if they had a reference portion if you want to understand grammar rules.
duolingo,4,72,good so far.
duolingo,4,72,learning japanese and i'm feeling like i'm retaining most of the information i'm given.
duolingo,4,72,very easy to use.
duolingo,4,72,"i understand the need for ad revenue and they do a really good job of giving as but not shoving them down your throat, but i only dislike the ""lives"" thing since they'll ask what a word is even though they haven't taught you so you'll get it wrong and then lose a life which you only have 5 of."
duolingo,4,72,"on the other hand the ""get 1 life"" thing makes me not dislike losing lives too much."
duolingo,4,4,probably best suited to those who like learning by example rather than rules.
duolingo,4,4,"however, i’ve found it very useful in starting a language, spanish in my case, several years after a full set of university courses."
duolingo,4,4,plumes: -free mode is legitimate useful and as aren’t very intrusion.
duolingo,4,4,"and don’t worry, you can turn off the owl’s pestering “support” and modifications."
duolingo,4,4,"-de team is responsive, if slower than ideal."
duolingo,4,4,they’ve implements previous suggestions like adding pages for each subject explaining relevant rules (for spanish) and allowing words to be snapped in the build a phrase with included words exercises (at least in the phone pp).
duolingo,4,4,they appear to continue adding different correct pleasing/translations that will be accepted.
duolingo,4,4,-easy to switch between using a phone and computer brother.
duolingo,4,4,-i haven’t had any real stitches in a long time.
duolingo,4,4,i used to have issues where the pp would forget i completed a lesson but oddly kept the experience points.
duolingo,4,4,much may have been due to my poor data connection with a previous cellular provider.
duolingo,4,4,downloading lessons (with subscription) was not very useful to me.
duolingo,4,4,"suggestions: - allow editing of previous wrong answers rather than requiring recently, especially when the mistake is a small type -desperately needs a greater variety of phrases."
duolingo,4,4,translating something 10 times is no longer beneficial repetition but annoying rose memorization -long term goal: exercises would ideally adjust difficulty on the fly to the user’s skill level.
duolingo,4,1,in general i love the pp but two things are odd (i'm using it for japanese - don't know whether it appears in other languages): 1. i've heard it is not possible to change how the speaker reads certain anti (symbols) but very often the other (more complex) reading are used 2. the volume levels are off.
duolingo,4,1,the speakers voice volumes are very very low (in comparison to other phone applications) and the wrong/correct sound is very loud - increasing volume hurts ears
duolingo,4,1,"helpful in learning the formal version of a language, but not as much the common conversational version."
duolingo,4,1,"reaches through repetition, which is a good approach, but doesn't teach some of the challenging parts, especially verb conjunction, in a manner that is easily understood or even organized."
duolingo,4,1,i almost stopped doing spanish out of frustration.
duolingo,4,1,would easily give this 5 stars if it taught verb conjugations in an organized manner in the beginning.
duolingo,4,1,"i love this pp, i definitely think its been a big help to learning japanese give never even thought about reading japanese before but now in getting close to being able to."
duolingo,4,1,"i wish it would have you draw the characters as well, maybe that comes later on?"
duolingo,4,1,"i definitely can write it, but can tell you what it is, so maybe that an addition they could add someday to the program?"
duolingo,4,1,otherwise it would be 5 stars!
duolingo,4,2,the new garlic course is well written and well thought out.
duolingo,4,2,"the only reason it is not 5 stars is one of the voices has too thick an accent to hear properly, and it is only on guess work that i get the words and phrases correct when her voice is used."
duolingo,4,2,"very, very quick work to get it online."
duolingo,4,2,congratulations to the epic volunteers 🙂
duolingo,4,1,good for memorizing vocabulary although in basic unintuitive sentences.
duolingo,4,1,would do better with more spoken practice and photo/art to truly cement concepts in your mind.
duolingo,4,1,"""stories"" are a great feature."
duolingo,4,1,i feel this program could/should be accompanied with a tutor (not a high school language class) and you would expel fast.
duolingo,4,0,"being dutch, it is interesting to use this pp but often very frustration, particularly with computer voices that race through a sentence with the consequence of misunderstanding the words."
duolingo,4,0,"the translations into english are often strange to my ears, obviously 'dictionary translations' and not in english vernacular, having unusual placement of nous and verbs."
duolingo,4,0,"suggestions from users are, however, mostly accepted."
duolingo,4,0,"the dutch is often extra long minded, not simple to translate, even for me."
duolingo,4,0,very fun and helpful tool to dear a new language!
duolingo,4,0,"though i dislike the heart mechanics, i do under stand why its there."
duolingo,4,0,good pp overall.
duolingo,4,0,but the listening part does not work on my galaxy s+ as nothing plays back when i touch the button.
duolingo,4,149,"it is a great pp, especially if you want to practice vocabulary."
duolingo,4,149,"i have a couple of suggestions: 1) the sentences are never too complicated and they rarely used vocabulary from previously completed lessons; 2) in the word selection pool most of the time the first word has a capital letter, which makes it too easy to identify."
duolingo,4,149,"that's a pity, because many times the first word is an article and identifying the gender is a challenging part in some languages."
duolingo,4,0,as a beginner its a fantastic pp... but whether we'll be able to learn the language completely??
duolingo,4,0,but still its an amazing pp to learn languages i find it interesting and fun😍😘
duolingo,4,22,great pp for learning languages.
duolingo,4,22,"i only wish it allowed for tying the answers instead of multiple choice “tapping,” which is too easy."
duolingo,4,22,"when a sentence has seven words in it and there are only ten choice, you hardly need to know much of the language to figure it out."
duolingo,4,22,it would be much better if we could enter the answers from memory like on the domingo webster.
duolingo,4,22,seeing how they have this feature on the webster (hence the apt for it already exists) it shouldn't be too hard to make this change.
duolingo,4,3,really great for free version!
duolingo,4,3,i have had a great experience using this for the last week.
duolingo,4,3,refreshing my spanish because i've lost connection to my mother tongue.
duolingo,4,3,"for new languages however, i'd like for there to be writing included."
duolingo,4,3,"i can type in the spanish, but for the organ and japanese there isn't even tracing."
duolingo,4,3,wondering if it'sin the works as i'ma hands on learner.
duolingo,4,3,i also have the keyboard download on my phone to use as an option.
duolingo,4,3,hope to see this included if it's not.
duolingo,4,3,:)
duolingo,4,1,the new progress quite is no good as it's asking questions i've not learned.
duolingo,4,1,brilliant pp that make learning easy.
duolingo,4,1,"would like to see questions reduced to 15 not 20 per session and the ""type what you hear"" needs to be a little bit more clearer but it's more realistic but sometimes hard to distinguish."
duolingo,4,1,overall it's the best pp out there and i've paid for others where you can do this free
duolingo,4,0,this pp is very helpful.
duolingo,4,0,i installed it so i could learn spanish and french for school.
duolingo,4,0,"i have to say that i knew no spanish whatsoever, and now i am getting better at it."
duolingo,4,0,the only thing i would change is to remove the hearts thing.
duolingo,4,0,you only get 5 hearts at a time.
duolingo,4,0,"and if your a started like me, then you are probably donna make mistakes."
duolingo,4,0,"also, when you are supposed to speak into the microphone, it doesn't hear me and counts in wrong."
duolingo,4,0,"if these 2 things weren an issue, this pp would get 5 stars"
duolingo,4,11,"i really enjoy do in the past, but i don't like the new leveling system."
