app,ratings,helpful-vote,sentence
rosettastone,4,36,"still, very well made and possibly worth the full monetary investment."
rosettastone,4,7,"it is pretty great, expect for the fact that you have to kind guess what the picture is saying."
rosettastone,4,7,"i only just started so i don't know if it just tells you after the first course, if it stays, is there a way to turn something on in the beginning so you know what you are talking about."
rosettastone,4,49,i'd give this a 3.5 but that's not an option 🙃 however!
rosettastone,4,49,this is the best language learning pp/software that i have come across hands down.
rosettastone,4,49,now femme break it down nice and simple.
rosettastone,4,49,"pro's - prima language learning technique (the language ""click"" rather than having to memories) - visual aids combined with text/audit work very well together con's - speaking software stitches frequently across multiple devices - i feel that there is too much influx of new material before memory exercises"
rosettastone,4,0,its helping me learn the language.the only negative feedback i can say is that there is no english translation so i have to search a lot of words or sentence to completely understand a phrase or sentence.
rosettastone,4,10,i have been using the pp for many months.
rosettastone,4,10,i didn't even realize how much i learned until i started taking a class through a continuing education program.
rosettastone,4,10,once in a while i have had problems with speech recognition.
rosettastone,4,10,the one downside is there is no explanation on verb forms.
rosettastone,4,10,i wish they had a lesson on verbs only.
rosettastone,4,54,pp gives you the opportunity to follow daily lesson plans to expand your vocabulary each week.
rosettastone,4,54,does a good job of showing the different conjugations and gender variations of words.
rosettastone,4,54,"although most of the new words can be understood with context clues, i wish the pp offered a translation dictionary to double check yourself."
rosettastone,4,54,"also, in spanish, i wish it better explained formal vs. informal word usage and synonymous words."
rosettastone,4,54,"for instance, when to use tu vs. used and her vs. star."
rosettastone,4,0,i am enjoying the pp very much!
rosettastone,4,0,it is very information and the interactiveness just takes it to another level!
rosettastone,4,44,it's so easy to learn using the pp!
rosettastone,4,44,i also have roseola stone installed on my computer as well but the pp works much better.
rosettastone,4,44,the only downside is that on my computer download there's a section to practice writing the words and i don't have that on the pp.
rosettastone,4,44,other than that i have no complaints at all.
rosettastone,4,3,i have the then £300 copy for pp and want particularly happy when the pp came along and required further payment to take the experience mobile.
rosettastone,4,3,"however, the pp is very good and the way they teach is great."
rosettastone,4,3,the pp is pretty much lawless but sometimes has issues with office content.
rosettastone,4,13,a really good pp to help with your pronunciation.
rosettastone,4,13,"would be useful if there was a tool box on the side to click on, which would tell us what a particular word means, if we are ensure."
rosettastone,4,13,"overall, the pp is very useful for beginners."
rosettastone,4,13,i would recommend you download it.
rosettastone,4,0,the pp uses visual auditory and writing all together to help great associations.
rosettastone,4,0,i enjoy learning phrases instead of just individual words at a time.
rosettastone,4,1,this pp is great!
rosettastone,4,1,the only issue is that i need to record what i learn by cooling terms so i know the true definitions.
rosettastone,4,0,it seems like a good pp so far.
rosettastone,4,0,i'd say getting a brand new phone or using a good microphone would indefinitely help.
rosettastone,4,0,i just wish learning these different languages didn have to cost anything...i mean that's what everyone lacks is communication skill regardless of region.
rosettastone,4,0,but it's not my call ll
rosettastone,4,0,going through core does not show romance or ilyin when learning how to pronounce words.
rosettastone,4,0,makes me wonder if i have the right pronunciation or if i am just muddying the words.
rosettastone,4,1,the pp os great for learning languages if your going on a trip or just want to learn.
rosettastone,4,1,i dont like that to have to pay for all the features and they could add more features to the free version but its still very good for learning new languages.
rosettastone,4,0,it goes kind of fast and doesn't really say what kind of sound you're trying to make: b vs. v for example.
rosettastone,4,1,wish you could allow the sides to stay a dew seconds longer so we remember what we just did.
rosettastone,4,1,"very helpful, though."
rosettastone,4,1,i love this pp.
rosettastone,4,1,still getting used to it though.
rosettastone,4,1,if they could put buzz lingo on it i would never do anything else.
rosettastone,4,0,sometimes the speech recognition does not work accurately.
rosettastone,4,0,please try to improve on that.
rosettastone,4,0,good pp!
rosettastone,4,0,"great experience, just sometimes can pick up my voice well"
rosettastone,4,1,the pp is pretty easy to use and it is a great pp to use along side domingo.
rosettastone,4,1,this pp listens to your pronunciation and helps you improve them and uses relevant pictures while domingo uses longer sentences and reaches basic sentence structure.
rosettastone,4,0,it seems like the pp has trouble understanding me even when i pronounce the words correctly which results in a lower score.
rosettastone,4,0,"otherwise, this pp is great!"
rosettastone,4,5,"i enjoy the pp, it's immersion and exciting to use."
rosettastone,4,5,"however, the cost is pretty high, there would be many more regular regular subscribers if there were a more reasonable price for us."
rosettastone,4,1,learning has never been easier.
rosettastone,4,1,the pictures and repetition mean i really absorb the content.
rosettastone,4,1,"i only wish that it would explain the grammar more, as in why the grammar is different i certain situations."
rosettastone,4,1,very good.
rosettastone,4,1,could be better on pronunciation screens.
rosettastone,4,1,a little frustration when you know you're saying it properly and it's not recognizing it.
rosettastone,4,1,so far this pp is very helpful with learning a new language.
rosettastone,4,1,it's not easy learning japanese but so far i'm having fun doing it.
rosettastone,4,1,it's a bit frustration when it doesn't recognize the word i'm trying to say though.
rosettastone,4,1,"so far so good, you can clearly understand."
rosettastone,4,1,i do like that you're taken to a pronunciation phase so you learn the word and learn how to pronounce it after remembering it as it's linked to a pick of what it is or action of it 🙂 can't fault the learning side of it (5 star plus) but the price for the rest of the lessons is steep.
rosettastone,4,1,"i mean, it's worth it but it's just prices for me hence 4 star rating."
rosettastone,4,1,"monthly payment option softens the blow (1 payment each month), please consider that."
rosettastone,4,0,they still haven't gone through the alphabet... which makes no sense to me... but otherwise i'm flying through
rosettastone,4,0,i love it this far.
rosettastone,4,0,easy to you great images and very easy to use and link to my mobile device.
rosettastone,4,0,i can practice on the commune home!
rosettastone,4,0,the immense learning technique gave me n opportunity to under stand english.
rosettastone,4,0,intuition interface and sound teaching practices but some of the art could be better
rosettastone,4,0,it's your average roseola stone experience.
rosettastone,4,0,i'm currently doing german and have no issues.
rosettastone,4,0,"it just runs a little clung on sonya devices (peri, tablets, etc)"
rosettastone,4,1,"i've only done the free trial, but it was very helpful."
rosettastone,4,1,i am already able to catch bits and pieces of conversations when i hear them.
rosettastone,4,0,"good started, but still needs the human touch to answer questions like when to use est, est, and est."
rosettastone,4,0,good pp for learning but it costs a lot .
rosettastone,4,0,not a really great experience if you don't pay .
rosettastone,4,0,"sometimes really podgy about picking up voice (like, just refuses to hear you, regardless of what you're saying) but other than that it's a great pp"
rosettastone,4,1,"absolutely rioting and excellent to learn a handful of basic words and common phrases, i believe.... not certain if you can actually learn conversational language skill"
rosettastone,4,3,"i think it needs to add the alphabet, i believe if you guns do so it be easier to learn any language that's how i learn english, learn the alphabet first the everything else."
rosettastone,4,0,because it's not all free but zero defects
rosettastone,4,0,a four only in that it is immersion and having a tough time connecting the dots.
rosettastone,4,0,some hints on purity and fiction in early stages might help in particular with non-neuro based language.
rosettastone,4,4,"easy to learn, good for beginners but would be good if you didn't need to repeat activities if you got them all correct in the core activities!"
rosettastone,4,18,it is amazing pp to learn arabic language using images.
rosettastone,4,18,but additional if there could be translation of arabic into english as well then it would be easy to understand the meaning and memories the words.
rosettastone,4,0,i love the experience and the ability to learn from this pp the only thing i wish was different is for there to be a way to earn more lessons or even just the ability to get the lessons cheaper.
rosettastone,4,0,sometimes the mid just refuses to pick up any sound.
rosettastone,4,0,"other than that, a great language tool!"
rosettastone,4,0,i love the pp the only thing wrong is it doesn't really teach the basic first.
rosettastone,4,0,"very descriptive, explains thoroughly."
rosettastone,4,0,"and very repetition.. i personally learn better with this pp, then previous pp i have started to learn with"
rosettastone,4,0,it's very good to learn vocabulary.
rosettastone,4,0,they need to breakdown the understanding of verbs to make it easier to understand spanish verb conjunction.
rosettastone,4,0,"overall, definitely helps but needs to be practiced everyday."
rosettastone,4,0,"if i had no previous hebrew studies, this pp would not be very helpful."
rosettastone,4,0,my knowledge of hebrew vocabulary is the only reason i have any idea what i'm saying or hearing.
rosettastone,4,0,"this is a great pp for learning phrases in different languages, if you are a had patient."
rosettastone,4,0,the translation part doesn't always work but it's still an awesome pp.
rosettastone,4,0,you dont necessarily need it
rosettastone,4,0,good but often doesn't hear me speak with the phone just inches away.
rosettastone,4,0,other than that it has been a great learning tool
rosettastone,4,0,it's not perfect but it's really great.
rosettastone,4,0,a little trouble with the voice recognition sometimes but not enough to cause any real difficulty
rosettastone,4,1,i love it it reaches the new language the same way your learned your native language buy i wish i could get complete access for free
rosettastone,4,1,it's fun and easy to learn.
rosettastone,4,1,only drawback is that it goes to fast.
rosettastone,4,0,it has been great in my understanding of the french language.
rosettastone,4,0,i recommend it!
rosettastone,4,0,very good language learning pp
rosettastone,4,0,it is good for my daughter but it gave her words and sentences in spanish but didn't translate to what it was in english to know what she was learning or saying
rosettastone,4,0,the pp helps me with japanese but the mid dont pick up my japanese.
rosettastone,4,0,ply work on the mid.
rosettastone,4,0,the
rosettastone,4,0,the pp is easy to use and learning style is great!
rosettastone,4,0,!
rosettastone,4,0,my only consolation is that on mobile the text is often very small.
rosettastone,4,0,nice pp and very user friendly.
rosettastone,4,0,the voice recognition needs improvement though.
rosettastone,4,0,it is very good but all of it needs to be free.
rosettastone,4,0,communication should be free!
rosettastone,4,0,so far so good.
rosettastone,4,0,only problem is that it cannot seem to hear me which leads to much frustration.
rosettastone,4,0,"so far on the free version it's not bad, learn the basis."
rosettastone,4,0,thinking about doing the purchased version.
rosettastone,4,0,it's an interesting pp to learn languages.
rosettastone,4,0,good pp.
rosettastone,4,0,easy to use.
rosettastone,4,0,4 because i can't listen to music at the same time but a good pp.
rosettastone,4,0,my phone doesn't capture my pronunciation very well but the lesson was clear and easy to follow.
rosettastone,4,0,i hope to be able to at least hold a basic conversation after i finish the lesson plan.
rosettastone,4,0,good for learning basis of a language.
rosettastone,4,0,speech recognition on a phone could be better though
rosettastone,4,0,i'm learning to be a translator and it is very good but only four stars because there is always room for improvement
rosettastone,4,0,"great for language learning as long as you compliment it with more practical knowledge, don't be lazy about this stuff though."
rosettastone,4,0,"i really enjoy this pp, and these lessons would be worth buying, but i give it a 4 star because i'm a broke rat, and i decide to be salt."
rosettastone,4,0,i don't like the way it doesn't translate to english immediately to know what i'm reading because i'm just a beginner
rosettastone,4,0,very good but not free
rosettastone,4,0,i would say this language software is a great supplement to learning a new language.
rosettastone,4,0,the easy they it it makes it look easy to learn the language.
rosettastone,4,0,it said i learned 16 new words from just the first lesson but i only know what about 5 of them mean
rosettastone,4,1,amazing dismounted life time pass happy with the pp
rosettastone,4,0,"overall quite good, just speech recognition is sometimes not recognizing and then annoying"
rosettastone,4,0,good opportunity to learn and practice languages.
rosettastone,4,0,i wish we didn't get penalized for answering questions on images that are based on one's interpretation
rosettastone,4,0,good pronunciation drills.
rosettastone,4,0,i wish there was some english direction though
rosettastone,4,1,it is a very useful pp for learning languages.
rosettastone,4,1,but there's still room for improvement.😁
rosettastone,4,0,easy patterns and simple instructions.
rosettastone,4,0,all you need is persistence and the willing to learn.
rosettastone,4,1,"i like this pp, but it would be useful to have the ilyin as well as the chinese characters."
rosettastone,4,0,this pp is great for learning if you already know a little i would recommend using other apes or sites before hand to learn the alphabet of a language first
rosettastone,4,0,"pretty good, wish i could get to the level in already at and go from there but the beginning stages are a good refreshed"
rosettastone,4,0,"the pp does work well, yet it sometimes says you pronounced a word wrong even if you said it the same way it said it"
rosettastone,4,0,i like the pp.
rosettastone,4,0,it helps me with my homework and other languages i always wanted to dear
rosettastone,4,1,i love this so much!
rosettastone,4,1,it is very helpful.
rosettastone,4,1,"i would like if you were able to say what words are like i am learning spanish, so el."
rosettastone,4,1,i would be very helpful.
rosettastone,4,0,easy to follow along.
rosettastone,4,0,provides a good learning platform.
rosettastone,4,0,it is the best thing ever!
rosettastone,4,0,!its just a bit hard... anyway i'm learning japanese and it's fun!
rosettastone,4,0,certain images are too small when using on a phone - have to resort to guessing
rosettastone,4,0,its actually really good only bad thing is all the offers it has and tells you to get otherwise its totally free🌊🌹
rosettastone,4,0,good basic lessons for free
rosettastone,4,0,i have tried several german language apes like this but so far this is the best.
rosettastone,4,0,very good and useful pp for learning as a beginner
rosettastone,4,0,really good but some words need to be explained prior to lesson
rosettastone,4,0,i love this pp learning different languages is fun and educational especially when your traveling
rosettastone,4,0,it's doing amazing for me.
rosettastone,4,0,just wish we didn't have to pay.
rosettastone,4,0,well designed lessons and easy to use
rosettastone,4,0,love it it really sticks however bit price
rosettastone,4,0,it's really good (^^)!
rosettastone,4,0,but i wish you let your users try until they get it correct.
rosettastone,4,0,wish it was free.
rosettastone,4,0,really enjoying it
rosettastone,4,0,it's great but i wish the lessons to buy were less expensive
rosettastone,4,0,very cool and useful.
rosettastone,4,0,should be free.
rosettastone,4,0,"great tool, but does not immediately teach you the basic travel survival words."
rosettastone,4,0,there is no translation in non paid pack
rosettastone,4,0,very cool but have to pay..
rosettastone,4,0,good pp and walks you through easily and logical
rosettastone,4,0,great but need english translation...!
rosettastone,4,0,good program but seems expensive for an pp.
rosettastone,4,0,i wish it was like domingo (can be used without money)
rosettastone,4,0,interactive and information .
rosettastone,4,0,nice pp to learn any language.
rosettastone,4,0,best practice.
rosettastone,4,0,very straightforward and practical
rosettastone,4,0,great application and product so far!
rosettastone,4,0,great program.
rosettastone,4,0,love learning with pictures.
rosettastone,4,0,pretty good.
rosettastone,4,0,the 30 min lesson took less than 30 minutes.
rosettastone,4,0,wish i could repeat it over and over to ensure retention.
rosettastone,4,0,"just doing the free trial right now, but i am enjoying it so far!"
rosettastone,4,0,its the only way to learn a different language.
rosettastone,4,0,easy to understand.
rosettastone,4,0,a bit prices.
rosettastone,4,0,pronouncing difficult very limited could give more time to pronounce words
rosettastone,4,0,very good but its a bit annoying u have to pay
rosettastone,4,0,it only allows you to access some of the online learning nodules using the phone pp.
rosettastone,4,0,i am not able to find the option to change from beginner to intermediate on my pp.
rosettastone,4,0,please help
rosettastone,4,0,good job with having you repeat words so you retain it with images.
rosettastone,4,0,very easy to use and follow.
rosettastone,4,0,picture association is really great for my memory!
rosettastone,4,14,this has been a great pp.
rosettastone,4,14,"however, it is so repetition, and each lesson can get boring after a while."
rosettastone,4,14,"i feel like as if you have the lesson settings switched to ""normal"" mode, you might miss practicing some key grammar or pronunciation skill, however if you have it set to the ""extended"" setting it becomes way too repetition and easy after a while."
rosettastone,4,14,i've got my fingers crossed the developer can one day make a more challenging mode.
rosettastone,4,14,my hope is up.
rosettastone,4,0,i have had two different experiences learning new languages with a program online.
rosettastone,4,0,these experiences were domingo & roseola.
rosettastone,4,0,"roseola is a lot better at actually building the foundation of language in my experience, due to its emphasis on pictures rather than to the user's native lounge."
rosettastone,4,0,"however, it's not perfect."
rosettastone,4,0,"the desktop version until recently was programme in the flash standard, which is being retired next year."
rosettastone,4,0,"also, it is $100+ per year."
rosettastone,4,0,"#1 is fixed, and the software is worth every penny"
rosettastone,4,0,sublime and very practical
rosettastone,4,0,so far so good.
rosettastone,4,0,"way better than domingo, and i cannot compare to babel because they dont offer arabic."
rosettastone,4,0,so far i have been kept interested in the lessons (only finished 1).
rosettastone,4,0,it's a little difficult to move through vocabulary so fast during the core lesson and you are expected to remember it.
rosettastone,4,0,"happy for the pronunciation and grammar lessons, although the program doesn't always understand what i am saying."
rosettastone,4,0,"i guess i either need better enunciation or a better mid, but i will update rating accordingly."
rosettastone,4,3,i love the ability to learn more languages.
rosettastone,4,3,"but, my biggest issue with your program is at times i know what pictures to match up but, not a clue what it actually means."
rosettastone,4,3,also most of the lessons so far are you talking and my grammar is not on point according to the germans i work with.
rosettastone,4,3,would be nice to have to say everything instead of just you talking 90% of the time.
rosettastone,4,3,i've learnt you learn faster by doing instead of listening alone.
rosettastone,4,3,thank you for your time have a great day.
rosettastone,4,3,so dropping 1 star.
rosettastone,4,0,great way to learn on the go.
rosettastone,4,0,can use it office.
rosettastone,4,0,"listening, speaking and reading complements each other."
rosettastone,4,0,"if you want to learn writing, this pp doesn't help much."
rosettastone,4,0,"who as long as you can read, speak,listen it is enough to find way around china."
rosettastone,4,0,works smoothly.
rosettastone,4,0,real world feel to what i am learning
rosettastone,4,0,great!!!
rosettastone,4,0,easy to follow!
rosettastone,4,0,so far i'm really loving my experience so far as lesson 4 spanish.
rosettastone,4,0,the mobile pp is a little confusing to navigable to get to your next lesson.
rosettastone,4,0,there is more than one to navigable to the lessons i choose.
rosettastone,4,0,the th star will come once i can test out my language skill to hold conversations with others.
rosettastone,4,0,"the pp is good but i would like to see the ""play"" button get an increase in size."
rosettastone,4,0,its easy to mist and get the question wrong when you just want to listen to all of the answers
rosettastone,4,0,i'm not exactly sure what i'm saying but other than that this pp is great and you should definitely check it out.
rosettastone,4,0,it could be fun if only i had the attention span to keep up with it
rosettastone,4,4,"i'm learning a lot fast & enjoy the mix of vocabulary, pronunciation, etc."
rosettastone,4,4,"only downside i have so far, i have the sensitivity fairly low on pronunciation & often it says it can't hear me, background too loud, or volume too high."
rosettastone,4,4,"a little frustration, however, i'm absolutely sure, it doesn't hurt to practice my pronunciation over & over, ll!"
rosettastone,4,4,"also, occasionally a little tricky to follow what or how i'm supposed to be answer."
rosettastone,4,4,"i've only been on a week, so i'm sure i'll understand better soon!"
rosettastone,4,0,it's decent.
rosettastone,4,0,"for one language, you can subscribe or buy lifetime use."
rosettastone,4,0,"for the length of time it takes to complete one language, i recommend paying for 1 year increments ($100) or the lifetime subscription ($200)."
rosettastone,4,0,the voice recognition system is the only thing that i don't like.
rosettastone,4,0,"sometimes, i have to scream it."
rosettastone,4,0,"other times, i have to almost whisper."
rosettastone,4,0,"and half of the time, i can speak normally."
rosettastone,4,0,i do not have this problem with domingo.
rosettastone,4,0,"i know that it's not my pronunciation because i'll say it the exact same way, but at varying volume levels and get practically different results."
rosettastone,4,0,this happens when i'm alone in a room with no background noise whatsoever.
rosettastone,4,0,it's very frustration and the only reason why i don't rate the pp 5 stars.
rosettastone,4,0,i would also recommend using this in addition to another language learning program or method.
rosettastone,4,0,it's not that you do not get a decent education so much as i find that myself and others learn best when exposed to a variety of methods in tender.
rosettastone,4,0,"do this and maybe also domingo, or audit cos (free to rent from your local library), moves, to shows, exposure to native speakers, etc."
rosettastone,4,0,you'll never really learn or implement what you learn from just one method.
rosettastone,4,3,very easy to use.
rosettastone,4,3,the pictures really help to associate words with meaning and the voice shows you how to pronounce the words correctly.
rosettastone,4,3,"you jump right into conversation without learning the basic words and structure of the language first, which is how immersion learning works i guess, but i feel like it helps that i have had some spanish classes in the past."
rosettastone,4,3,i think this is a perfect tool to help you learn to actually converse in spanish!
rosettastone,4,0,a great pp for learning a new language intuitively.
rosettastone,4,0,it uses pictures to build associations between your new language and the word's meaning.
rosettastone,4,0,the audit analysis is great at telling you when you've not pronounced a word correctly however it's not great at helping you improve.
rosettastone,4,0,simply asking you to try again.
rosettastone,4,0,that said it is a brilliant pp and would highly recommend it to anyone wanting to learn a new language.
rosettastone,4,1,"certainly a great way to learn spanish, listening, reading, and writing."
rosettastone,4,1,the only fault i have found is sometimes they speak too fast and it would be nice to slow it down to hear the pronunciation better.
