app,ratings,helpful-vote,sentence
duolingo,4,1,domingo does a good job offering all sorts of different problems to help you learn.
duolingo,4,1,"it offers watching, listening, speaking, and written answers to help your learning."
duolingo,4,1,it would be better if it had taiwanese though.
duolingo,4,1,other than that it's a great pp.
duolingo,4,1,"so far, very interesting and fun way to refresh my basic level of spanish."
duolingo,4,1,"i am almost done with most of the levels available, not sure what happens next and if you need to pay to get to further levels."
duolingo,4,1,already recommended to some friends.
duolingo,4,0,it's a nice alternative to paying for a language software.
duolingo,4,0,"i would give it 5 stars but i think the length of time you have to wait for your hearts to refill is a little much, especially since they cap at 4"
duolingo,4,0,"good cap but after a while asks for subscription, which is quite irritating."
duolingo,4,1,their points system keeps me motivate to keep learning!
duolingo,4,1,i'm learning japanese and they integrate anti fearlessly into the lessons.
duolingo,4,1,"after 3 years of studying japanese in school, i couldn't tell you any anti."
duolingo,4,1,"now with domingo, i feel like a pro!"
duolingo,4,1,much more confident speaking to my family in japan.
duolingo,4,1,the best i've tried.
duolingo,4,1,"if you aren't a casual learner, just go gold on all lessons before starting others, and do practice (“health healing”) often."
duolingo,4,1,"sometimes small types get you a full error (can be annoying), but isn't a frequent issue."
duolingo,4,1,this pp is very easy to use and the format with the little owl moscow is super cut so it makes me want to spend time using it.
duolingo,4,1,the only reason i did not give it five stars is the one language i was originally looking for (tagalog) was not one of the option to learn.
duolingo,4,0,this is a decent pp for beginning to learn spanish.
duolingo,4,0,there is a lot of repetition in the lessons which seems to limit the amount of new words that could be introduced under each category.
duolingo,4,0,its mainly learning vocabulary and not verb conjunction.
duolingo,4,0,"for me as a 73 year old trying to learn garlic, i would like to be able to completely red lessons as many times as i need to so it gets firmly embedded in my head."
duolingo,4,0,"so far i haven't found a way to do that, only the practices, which don't seem to be enough."
duolingo,4,0,"other than that, i really like the pp & the methodology used."
duolingo,4,1,"really educational, fun and easy to use."
duolingo,4,1,occasionally have issues with lessons loading up and there have been a couple of the speaking questions that wouldn't accept your answer unless it was in english but all in all it's a good pp.
duolingo,4,0,enjoyable way to start learning a language.
duolingo,4,0,with japanese a bit of rose learning of the alphabet may help the initial flow.
duolingo,4,0,also i hate the sound of getting something wrong.
duolingo,4,0,may be this could be toned down.
duolingo,4,0,i raises my anxiety levels and contributes to my giving up.
duolingo,4,0,i use this pp every day and i like it.
duolingo,4,0,but i have problem with the new update
duolingo,4,0,i wish this could be solved soon.
duolingo,4,1,i am enjoying the pp.
duolingo,4,1,in taking the chinese course and feel like in actually retaining the characters and their definitions.
duolingo,4,1,to actually learn using this pp.
duolingo,4,1,"i feel you actually have to put time in to get a good result, which is good!"
duolingo,4,1,"i had hoped it would help in teaching to write the characters, but so far i have seen none of it."
duolingo,4,1,"my only complaint is that sometimes the audit will not play, breaking the ""listen and repeat"" exercises."
duolingo,4,1,if that fixed the pp definitely deserves 5 stars.
duolingo,4,0,new update is not really as well as it used to be.
duolingo,4,0,listening and speaking exercises has serious problems and makes it hard for earners to enjoy learning hope domingo will fix it as soon as possible.
duolingo,4,0,gracious 
duolingo,4,0,i am highly upset.
duolingo,4,0,all of a sudden there are hearts where the red gems ( lights) used to be and if you get a sentence wrong it takes away the said heart.
duolingo,4,0,"when hearts are gone, i need to use blue gems to get more hearts."
duolingo,4,0,i want the old way back!!!!
duolingo,4,0,!
duolingo,4,2,stories are a great addition.
duolingo,4,2,they are very fun to complete.
duolingo,4,2,facing some bags after the new update .
duolingo,4,2,"it shows i'm in silver league in leaderboards , even the i advanced to the gold league.. it even shows in my achievement that i reached gold."
duolingo,4,2,"sometimes i have to click twice , to start the lessons ."
duolingo,4,0,"really enjoying this, and the pp is reasonably intuition though i would have appreciated the learning tips and the grammar notes being signposted/available from the start (i hear this was possibly only on the web version)."
duolingo,4,0,"while the amount of as (most irrelevant) has increased, so has the content and pass of practice."
duolingo,4,0,"learning a language should be fun yet practical- so maybe looking for sentences that make more sense then ""she boils chicken"" could be part of the initial lessons to keep the users engaged."
duolingo,4,0,male french pronunciation seems suspect at times.
duolingo,4,0,female is fine.
duolingo,4,1,it has been very helpful in getting basic phrases down.
duolingo,4,1,"it doesn't do much to explain some of the santa and the voice speaks too quickly when you do some of the audit tests but for a free pp this is very, very good."
duolingo,4,1,"love this pp, learning a few different languages, adds are a bit annoying but you have an option to pay for no adds."
duolingo,4,1,"the sentences could do with rousing on basic language used when visiting the country but, good for learning different languages."
duolingo,4,0,"during is an overall great and fun learning pp with very helpful reminders to take your daily lesson, however everytime i try to make a profile it never works, and will either take forever and never load or it load for one second but not make the profile."
duolingo,4,0,it is very annoying and sometimes prevents me from my lessons.
duolingo,4,0,please fix this problem 🙏
duolingo,4,0,a very good pp for learning new languages!!
duolingo,4,0,i loved it... just wished that it would have a feature of controlling audit speed because sometimes difficult sentences or words are not understood with the same speed.
duolingo,4,0,"otherwise, fantastic !!"
duolingo,4,0,!
duolingo,4,0,"its seems like a good pp to learn a language, unfortunately, it doesn seem to incorporate simple reasoning for noun and verb applications."
duolingo,4,0,part of learning a language is learning why/how nous and verbs are applied when it comes to masculine and feminine and how to distinguish proper use.
duolingo,4,1,i like using it when i want to relax and to my surprise i have managed to memories some expressions and words although my sporadic use of it.
duolingo,4,1,"i think is a nice pp to use in one's free time to learn without stress and effort, but ease and comfort."
duolingo,4,0,this has almost been as helpful as a native speaker for me in teaching me german.
duolingo,4,0,it manages to be interesting and keeps the as to a manageable level.
duolingo,4,0,i just can' t use it for long periods of time without losing focus though.
duolingo,4,0,i have used domingo for over 2 years.
duolingo,4,0,it is a well organized program that covers the 4 aspects of language learning equally and well.
duolingo,4,0,i especially like the stories section that has been added.
duolingo,4,0,"the pp is enjoyable to use and motivation, but you need to get a book with some grammar in to understand the rules of the language"
duolingo,4,0,very good.
duolingo,4,0,fun.
duolingo,4,0,silly types can get annoying but overall awesome product
duolingo,4,0,"good for refreshing on vocabulary, grammar and sentence structure"
duolingo,4,0,teaching methods are great but please add rude to the languages taught.
duolingo,4,0,"also, if the tips contained a list of all the vocabulary taught in lesson for memorizing it would also help (ex: for japanese, all the letters with their pronunciation)."
duolingo,4,0,otherwise everything is good.
duolingo,4,0,"easy to use, clear voice to understand, works well with my andros motorola phone."
duolingo,4,0,"just starting out, so far so good."
duolingo,4,0,encouraging graphics.
duolingo,4,0,too many email per day takes it to 4/5
duolingo,4,0,the pp is pretty cool but i wanted to learn cantonese but it only had chinese but there a difference between cantonese and makarin and id like to learn cantonese please add cantonese and makarin!!!!
duolingo,4,0,that my only issue
duolingo,4,0,a fun way to learn languages!
duolingo,4,0,"my only problem is, the audit tracks aren't clear... they are trimmed too short."
duolingo,4,0,the first syllable (and sometimes the last one) isn't audible.
duolingo,4,0,please fix this issue.
duolingo,4,0,"i love this pp as a compliment for traditional classes, if you dont speak or practice the language domingo offers a way for you to increase your vocabulary and not forget the basis at least."
duolingo,4,0,nothing can match group interactions when learning but it is a fun way to study.
duolingo,4,0,"i love learning spanish on this pp, the leaderboards help make the learning more fun!"
duolingo,4,0,i would give it five stars but i recently finished and in the sapphire league and it didn't move me up to the ruby league.
duolingo,4,0,my pp might just be begged but it's pretty annoying to have to beat sapphire league again.
duolingo,4,0,free version is bordering on unable and that's pretty awesome.
duolingo,4,0,"5 stars would only be if there was no ""hearts"" or even if there was 10-20 free hearts after a day as this feature limits you from making mistakes and the pp even says mistakes help you to learn faster."
duolingo,4,0,"once you get into the swing of things, it can be fun."
duolingo,4,0,be nice if they maybe added alphabetical pronunciation and numbers to start.
duolingo,4,0,but well worth giving it a go.
duolingo,4,0,"plus i can find the pay now tax, if i wanted full version for a couple of months or year."
duolingo,4,0,in currently trying spanish.
duolingo,4,0,🙂
duolingo,4,1,i love it!!!
duolingo,4,1,i'm taking a french class in school.
duolingo,4,1,"(online because we don't have any foreign language teachers, and if we did there would only be spanish.)"
duolingo,4,1,"its kind hard to actually learn a language from an online class, so i started looking around and found this."
duolingo,4,1,i download it and so far it's been amazing!!!!
duolingo,4,1,!😁😁 i'm practicing all around the house now.
duolingo,4,1,"and i love the leaderboard, makes it a little competitive and encourages me to do it more."
duolingo,4,1,10/10.
duolingo,4,1,can put down my phone now because of it.
duolingo,4,0,it was all good till i reached the first check point i was learning spanish ...the checkpoint was too tough .i mean it had nothing of any sort which was taught ...it was just too difficult ..90% of the words were new..it made no sense why you would make it this hard..otherwise it is really good pp and very much user friendly ..but that checkpoint test .just breaks my heart
duolingo,4,0,many languages to choose from.
duolingo,4,0,good interface.
duolingo,4,0,"i think it could improve on how it reaches you verb conjugations, and that's why it gets 4 stars from me instead of 5."
duolingo,4,0,great!
duolingo,4,0,"the only suggestion would be to increase the frequency that you have to write the sentence in the language you're trying to learn, rather than translating to the language you already know."
duolingo,4,0,this would be super useful for training grammar.
duolingo,4,0,"good for learning the language, but the lessons can get a bit too long"
duolingo,4,0,it's a pretty cool pp and you should add like people to make friends with and to understand each other
duolingo,4,0,great pp.
duolingo,4,0,but you can only learn one language at a time.
duolingo,4,0,you cannot select multiple languages .
duolingo,4,0,fun and new experience in learning and reviewing languages.
duolingo,4,0,too many as and limitation of mistake allowance in the free copy makes it a bit frustration.
duolingo,4,0,"repetition exercises could be boring, but could be beneficial as well."
duolingo,4,0,i liked it overall..
duolingo,4,0,"it's good learning the basis so far, sometimes the voices blend too much for certain words making it hard to decide how to answer, but overall it's a good pp."
duolingo,4,0,pretty good.
duolingo,4,0,a little bit too easy and redundant.
duolingo,4,0,too focused on words and not enough on building sentences.
duolingo,4,0,lots of as too.
duolingo,4,0,"still, its pretty good."
duolingo,4,0,it's not a bad pp.
duolingo,4,0,great going at your own pace.
duolingo,4,0,the hearts take a long time to regenerate which can sometimes take the fun out of learning.
duolingo,4,0,i am certainly considering paying so i don't run out of lives.
duolingo,4,0,so i get uninterrupted learning
duolingo,4,0,"it is great pp, but it could be even greater if they make it into a program that makes our target language client."
duolingo,4,0,also it would be really helpful if they show us the stroke order for the letters of different language.
duolingo,4,0,(learning japanese) would be nice if we had the option to omit anti from the text until we've memories them from a corresponding tinycards deck submitted by domingo.
duolingo,4,0,"also, an option to enable questions in which the user submits japanese text they type would be much appreciated."
duolingo,4,0,"a fun way to learn, however the pp could use a glossy of words you've learned, as well as a proper pronunciation guide."
duolingo,4,0,"i can copy the voice perfectly, yet the pp still won't register that i've said it correctly."
duolingo,4,0,while i love easy leveling up they need to add more lessons to level 3 and 4 on the topics.
duolingo,4,0,"in the past there were 12 and 20 respectively, which i agree made it a bit boring but 4 is too little."
duolingo,4,0,maybe 8 and 12 lessons?
duolingo,4,1,pretty good.
duolingo,4,1,"the easier lessons get a bit repetition, there could be more variations on ways to say the same thing."
duolingo,4,1,otherwise very useful.
duolingo,4,1,i completed german and portuguese and have gone back for practice since.
duolingo,4,0,i like it.
duolingo,4,0,something different to do instead of strolling through twitter.
duolingo,4,0,the rewards make it more fun.
duolingo,4,0,i paid though so not sure what free pp would be like.
duolingo,4,0,"if you're serious about learning a language, you need to invest anyway."
duolingo,4,0,"this is a great pp, one thing i wish it had is that you can look up sentences and see how they are pronounced, so basically a dictionary."
duolingo,4,0,other than that you guns are amazing!
duolingo,4,0,love the french!
duolingo,4,0,😊
duolingo,4,0,this pp is definitely for people who know a little already.
duolingo,4,0,if i didn't already know hiragana and katakana i would be so stuck and probably would have given up.
duolingo,4,0,since i took two years of japanese many years ago this pp helps as a good reminder and listening practice.
duolingo,4,0,i am using the free version so the as can be annoying.
duolingo,4,0,i am finding that it is not moving me along as quickly as i would want to more difficult material.
duolingo,4,0,otherwise recommended.
duolingo,4,1,i really like the pp.
duolingo,4,1,"it would be nice to select a category to work on, though."
duolingo,4,1,then be provided with a summary of the lesson afterwards to reinforce the learning.
duolingo,4,1,i have a bad memory so i often forget what i've learned almost immediately.
duolingo,4,0,"it's a good start for a new language, but the audit seems to cut out for no reason periodically."
duolingo,4,0,might just be my phone?
duolingo,4,0,but it only happens with domingo.
duolingo,4,0,a great way to learn many different languages and overall there is so many to pick from although i would recommend adding more lives and more languages but this is a great learning pp and i have learned clot!
duolingo,4,0,^^
duolingo,4,0,a useful pp for learning and enforcing a language.
duolingo,4,0,"my only reservation is that my page (esperanto) is frequently revised, meaning my progress is often removed if i am to complete all the lessons in each new section."
duolingo,4,0,i find it easy to use.
duolingo,4,0,it has built my confidence and desire to stick with the effort to learn spanish.
duolingo,4,0,this pp is really great to practice language use.
duolingo,4,0,it makes it fun to learn new vocabulary and lessons.
duolingo,4,0,4 stars because i feel like you have to have prior basic knowledge of the language you want to learn before getting this pp.
duolingo,4,0,hi dear domingo team i am surprised by this pp every day more and more it's amazing but recently i got some troubles with sounds.
duolingo,4,0,i am not able to do the listening related parts.
duolingo,4,0,i'll be grateful if u fix it as soon as possible.
duolingo,4,0,i appreciate that the as in the free version aren't intrusion.
duolingo,4,0,"domingo is better suited for written comprehension-- it's best to practice a lot of speaking and listening through media and, if you can, native speakers."
duolingo,4,0,it's a good pp for learning third language.
duolingo,4,0,"for people like us who speak persian, learning english with this pp is impossible, because first is not one of its input languages."
duolingo,4,0,but i'm learning germany and it's been good so far.
duolingo,4,0,i just think it was better if it has better description in the beginning
duolingo,4,1,good pp with lots of free content to learn a big variety of languages!
duolingo,4,1,"just a few minor flaws (sometimes slightly awkward english translations, some pronunciation don't sound native, and the pp sometimes cuts me off mid-sentence in speaking exercises)"
duolingo,4,0,i've had the pp for 11 days and so far it seems to be working.
duolingo,4,0,"learning a language (spanish for me) is fun and challenging, i have a long way to go though."
duolingo,4,0,"i'm not using just the pp to learn spanish , i'm also reading lyric and listening to music and watching familiar moves i know in spanish with subtitles."
duolingo,4,0,this pp is definitely a foundation for the way i'm learning the language.
duolingo,4,0,excellent pp.
duolingo,4,0,hardly any adds.
duolingo,4,0,a good amount of repetition allows you to be confident in what you're learning.
duolingo,4,0,helpful comments/ tips on each lesson from other users.
duolingo,4,0,only issue was losing stories when twitching from apple to andros
duolingo,4,0,love the pp.
duolingo,4,0,there are times when i must select words and i can't because they don't fully appear on the screen.
duolingo,4,0,this prevents me from moving on to the next question..please fix.
duolingo,4,0,i'm using motor go-plus
duolingo,4,0,"excellent learning pp, could do with some descriptions of santa and grammatical quires as well as the lessons, and some languages (greek) don't have very good pronunciation."
duolingo,4,0,"overall, an excellent pp."
duolingo,4,0,"(also, what's after ruby league?)"
duolingo,4,0,good language learning pp that can be used for free without too many inconvenience.
duolingo,4,0,it lacks a bit of depth to explore the grammar or actual dialogue to listen to and learn from.
duolingo,4,3,i'm enjoying domingo stories and reaching my daily goal easier because of them.
duolingo,4,3,it also helps that there are hints and tips in the pp.
duolingo,4,3,i can't wait for stories in other languages.
duolingo,4,3,keep improving.
duolingo,4,0,it is a good pp for learning new ranges.
duolingo,4,0,"domingo straits you off with basic levels, there is different subjects."
duolingo,4,0,"if you get like 5 wrong on a lesson and you don't have domingo plus well ,your heart will have no lives and you'll have to wait 4 hours and about 23 minutes."
duolingo,4,0,"this pp is really good to learn, but i think it would be better without translate the words."
duolingo,4,0,translate is not the best way to learn a language.
duolingo,4,0,"in my opinion, use image would be better."
duolingo,4,1,this pp is great for learning new languages!
duolingo,4,1,the only problem i have is that why do you have to make a profile?
duolingo,4,1,can it save instead of making a profile?
duolingo,4,1,although great pp!
duolingo,4,1,i really recommend it for people trying out different languages.
duolingo,4,1,😋
duolingo,4,0,good pp..it's nice you can practice anywhere your phone is... could improve the pronunciation part though...haven been able to hear what the correct pronunciation is...it helps when you can slow the speaker down..
duolingo,4,0,"domingo succeeds in engaging me to learn hebrew, and it does this skillfully."
duolingo,4,0,"this is not only because i want to learn, but also because it makes it easy to cover the various aspects of the learning process - without requiring me to think too long about what to learn next."
duolingo,4,0,in new version it doesn't have sounds!!!!why?????
duolingo,4,0,?
duolingo,4,0,"it's great, though i wish it had a lesson first then the questions, so that we understand what is happening before answering questions to something we don't know how to pronounce."
duolingo,4,0,"but the pp is great, i would recommend"
duolingo,4,0,pretty good overall but has a few issues.
duolingo,4,0,lessons sometimes start without giving you enough information such as using words not previously taught.
duolingo,4,0,would be nice to have a vocal library to keep track of words you've learned so far.
duolingo,4,0,it's nice to use but i don't really like to type a lot.
duolingo,4,0,i prefer to press on the words because it's quicker and my keyboard on my phone is not the best.
duolingo,4,0,it's finicky.
duolingo,4,0,but overall i like the pp.
duolingo,4,0,most of the times it's easy to use.
duolingo,4,0,great tool to really learn and practice foreign languages 
duolingo,4,0,"4/5 because even if you can activate them, there's still a lot of as."
duolingo,4,0,"i've used this pp every day for eight months and am now able to say basic phrases, read russian ingredient lists, identify characters and guess the phonetics of new words, and write in russian characters."
duolingo,4,0,i am a plus member-- support this pp.
duolingo,4,0,some minor issues but overall a good experience.
duolingo,4,0,"for serious language earners, i would also suggest some kind of grammar rules rather than trying to understand them thou repetition."
duolingo,4,0,brilliant pp only thing i would change is give us the ability to search for words or phrases we have learned in the past so that we can familiarity our serves with the phrases that may be more suited to our experiences in the real world.
duolingo,4,1,"been great learning it so far, easy to use while traveling or just have an extra moment."
duolingo,4,1,i wish it let you practice the so each part more.
duolingo,4,1,it might later as i'm still new to this.
duolingo,4,1,"great overall, glad to be learning!"
duolingo,4,1,!
duolingo,4,0,great pp!
duolingo,4,0,very useful and interactive for learning be languages.
duolingo,4,0,"the main drawback in this pp is, while starting a lesson the desktop site provides an additional light bulb symbol which gives an overview about the lesson but in the pp its not available."
duolingo,4,0,i really like domingo!
duolingo,4,0,it takes you through the course slowly but surely -with a lot of repeats.
duolingo,4,0,i'm studying arabic and it is good for pronunciation- reading and writing.
duolingo,4,0,i would like more learning tips and some place where you could see the words you have learned & how to pronounce them .
duolingo,4,0,thanks
duolingo,4,0,"it's has helped me learn the basis so far, but the only small complaint i have is knowing how to resume where i left off in the lesson."
duolingo,4,0,i would say the pp isn't well organized in the home screen.
duolingo,4,0,"other than that, it's great!"
duolingo,4,2,what a fun and effective way to learn a new language!
duolingo,4,2,only complaint is they kind leave you in the dark when it comes to what the language rules are and why some things are the way they are.
duolingo,4,2,"but it comes with a nice ""forum"" of other users that do know the language and they leave helpful comments."
duolingo,4,0,quite good for learning and retaining phrases.
duolingo,4,0,there is a small audit problem though.
duolingo,4,0,sometimes it won't say the word out loud.
duolingo,4,0,its inconsistent with that.
duolingo,4,0,"but overall, it's a great way to learn a new language."
duolingo,4,0,"it is a great source of learning languages how ever i don't like this new heart system, it takes ages to refill and it stops learning."
duolingo,4,0,not a huge fan of this.
duolingo,4,0,good and easy pp to effectively learn a language.
duolingo,4,0,"the only thing i really miss is a list of the words that i learned, with in one column the english words and in the other the learned translation."
duolingo,4,0,needs more features for organ.
duolingo,4,0,"i noticed that when learning spanish, there were extra lessons you played ignore for, a new tax to listen to stories, and each lesson had a light bulb with good information before you started a lesson."
duolingo,4,0,organ does't have any of that.
duolingo,4,0,makes learning a language feel like a video game and i love that.
duolingo,4,0,my only issue is that the sound doesn't always work for new lessons (hiragana 2 specifically) and i'm stuck guessing (often incorrectly) what it wants from me.
duolingo,4,0,"lots of encouragement, repetition, different contents for same words, and different words for same sentences."
